expense_id,fund_code,expense_type,expense_category,vendor_name,expense_date,expense_amount,expense_currency,description,invoice_number,approval_status,payment_status,payment_date,allocated_to_investments,created_date,last_modified_date,fx_rate,fx_rate_as_of,fx_rate_source
ADMIN-EXP-862,ADMIN-FUND-003,Legal,Fund,Lee-Walls,2022-04-01,94812.65,EUR,Speak site value fact middle after no accept. Thus yet quite mission represent growth remain.,20698,PENDING,UNPAID,2022-04-01,,2022-04-01,2022-04-01,1.0,2022-04-01,INTERNAL
ADMIN-EXP-863,ADMIN-FUND-003,Travel,Transaction,Avila-Poole,2023-10-26,107423.08,EUR,Skin must security sing age teacher. Trade dark artist by second follow.,56206,PAID,UNPAID,2023-10-26,,2023-10-26,2023-10-26,1.0,2023-10-26,INTERNAL
ADMIN-EXP-864,ADMIN-FUND-003,Audit,Fund,"Graham, Koch and Mcpherson",2024-01-24,35639.07,EUR,Senior cup the strong how. Economic number plant language rule plan art boy.,88008,PAID,UNPAID,2024-01-24,,2024-01-24,2024-01-24,1.0,2024-01-24,INTERNAL
ADMIN-EXP-865,ADMIN-FUND-003,Legal,Transaction,"Morris, Lopez and Farrell",2025-04-08,36963.88,EUR,Dream when because someone admit. Maintain pay star despite movement able.,41855,PENDING,UNPAID,2025-04-08,,2025-04-08,2025-04-08,1.0,2025-04-08,INTERNAL
ADMIN-EXP-866,ADMIN-FUND-003,Other,Transaction,Woods Inc,2024-11-20,17134.76,EUR,Seek pull such. Defense conference again three.,13296,APPROVED,PAID,2024-11-20,,2024-11-20,2024-11-20,1.0,2024-11-20,INTERNAL
ADMIN-EXP-867,ADMIN-FUND-003,Audit,Fund,"Rose, Smith and Taylor",2021-05-16,43735.0,EUR,Her understand lot usually human campaign. Approach ago major line drive.,88611,PAID,UNPAID,2021-05-16,,2021-05-16,2021-05-16,1.0,2021-05-16,INTERNAL
ADMIN-EXP-868,ADMIN-FUND-003,Audit,Transaction,Jackson-Williams,2023-10-08,76975.6,EUR,Tax and simply rather lay. Possible enough memory memory according build set international.,79557,PAID,PAID,2023-10-08,,2023-10-08,2023-10-08,1.0,2023-10-08,INTERNAL
ADMIN-EXP-869,ADMIN-FUND-003,Other,Transaction,"Lawrence, Harrell and Miranda",2021-02-11,19654.45,EUR,His run artist billion. Too put several who side response air.,27148,APPROVED,UNPAID,2021-02-11,,2021-02-11,2021-02-11,1.0,2021-02-11,INTERNAL
ADMIN-EXP-870,ADMIN-FUND-003,Travel,Transaction,Simmons Inc,2022-08-08,74986.16,EUR,Tend book put coach. No bank they lot official medical.,38488,PENDING,UNPAID,2022-08-08,,2022-08-08,2022-08-08,1.0,2022-08-08,INTERNAL
ADMIN-EXP-871,ADMIN-FUND-003,Travel,Transaction,"Welch, Dixon and Moon",2024-07-31,104587.95,EUR,International gas hospital season. Walk me audience environmental trade kid letter.,86463,APPROVED,PAID,2024-07-31,,2024-07-31,2024-07-31,1.0,2024-07-31,INTERNAL
ADMIN-EXP-872,ADMIN-FUND-003,Legal,Fund,Davis Ltd,2024-08-10,31023.63,EUR,Not next rather exactly. Already candidate political start property. Four new run second let.,40030,PAID,UNPAID,2024-08-10,,2024-08-10,2024-08-10,1.0,2024-08-10,INTERNAL
ADMIN-EXP-873,ADMIN-FUND-003,Legal,Transaction,Price-Mcdonald,2024-05-01,15663.72,EUR,Minute over federal. No which should certainly minute.,69043,APPROVED,PAID,2024-05-01,,2024-05-01,2024-05-01,1.0,2024-05-01,INTERNAL
ADMIN-EXP-874,ADMIN-FUND-003,Audit,Transaction,Miller-Jackson,2025-03-07,49434.13,EUR,Push member agree build. Heavy writer interview. Charge yard pick size the good.,30187,PENDING,PAID,2025-03-07,,2025-03-07,2025-03-07,1.0,2025-03-07,INTERNAL
ADMIN-EXP-875,ADMIN-FUND-003,Legal,Transaction,Keith-Spears,2025-02-23,89221.86,EUR,Positive author put then news table recent. Pay read responsibility line star ball.,71300,PAID,PAID,2025-02-23,,2025-02-23,2025-02-23,1.0,2025-02-23,INTERNAL
ADMIN-EXP-876,ADMIN-FUND-003,Legal,Transaction,Poole LLC,2023-02-26,70196.83,EUR,Small sense and pretty. Middle sound although area top TV. Value yes then unit few suggest open.,39559,PENDING,UNPAID,2023-02-26,,2023-02-26,2023-02-26,1.0,2023-02-26,INTERNAL
ADMIN-EXP-877,ADMIN-FUND-003,Legal,Fund,"Lee, Duke and Henderson",2022-04-21,83215.46,EUR,Rich today line yourself. Hour adult have imagine.,54308,PAID,UNPAID,2022-04-21,,2022-04-21,2022-04-21,1.0,2022-04-21,INTERNAL
ADMIN-EXP-878,ADMIN-FUND-003,Audit,Transaction,Johnson Ltd,2023-10-14,30977.71,EUR,Nothing small chance seven network. Poor different consumer record.,91613,APPROVED,UNPAID,2023-10-14,,2023-10-14,2023-10-14,1.0,2023-10-14,INTERNAL
ADMIN-EXP-879,ADMIN-FUND-003,Travel,Fund,"Williams, Woods and Hogan",2022-08-05,35143.09,EUR,On we everyone black real. Line necessary method inside.,63754,APPROVED,UNPAID,2022-08-05,,2022-08-05,2022-08-05,1.0,2022-08-05,INTERNAL
ADMIN-EXP-880,ADMIN-FUND-003,Other,Transaction,Harris-Thomas,2025-08-30,75595.4,EUR,Notice live wear clear city. Fire authority power PM drug our under another.,85011,PENDING,UNPAID,2025-08-30,,2025-08-30,2025-08-30,1.0,2025-08-30,INTERNAL
ADMIN-EXP-881,ADMIN-FUND-003,Travel,Transaction,Hawkins-Anderson,2022-01-28,59494.77,EUR,Herself call huge according result number outside. Born traditional family feel machine.,14793,PAID,UNPAID,2022-01-28,,2022-01-28,2022-01-28,1.0,2022-01-28,INTERNAL
ADMIN-EXP-882,ADMIN-FUND-003,Legal,Fund,Barnes-Bowers,2025-02-23,90453.26,EUR,Within through away prevent always write out. South wind per guy kid new benefit.,70040,APPROVED,UNPAID,2025-02-23,,2025-02-23,2025-02-23,1.0,2025-02-23,INTERNAL
ADMIN-EXP-883,ADMIN-FUND-003,Travel,Fund,"Anderson, Nichols and Cruz",2024-02-06,19999.2,EUR,Rather game under. Stock imagine practice here teacher edge sea.,76704,PENDING,UNPAID,2024-02-06,,2024-02-06,2024-02-06,1.0,2024-02-06,INTERNAL
ADMIN-EXP-884,ADMIN-FUND-003,Audit,Transaction,"Patterson, Jackson and Kaufman",2024-12-03,76330.7,EUR,Sister or figure bank team consider. Reduce recently concern idea return memory above.,71469,APPROVED,UNPAID,2024-12-03,,2024-12-03,2024-12-03,1.0,2024-12-03,INTERNAL
ADMIN-EXP-885,ADMIN-FUND-003,Other,Fund,"Bowers, Ford and Perkins",2023-10-13,29981.29,EUR,Life culture doctor indeed blood development. Real chance force international American play.,74080,PENDING,PAID,2023-10-13,,2023-10-13,2023-10-13,1.0,2023-10-13,INTERNAL
ADMIN-EXP-886,ADMIN-FUND-003,Legal,Transaction,"Hampton, Fleming and Cervantes",2025-02-23,45111.16,EUR,Will as theory wall. Age record blue step rise gas.,91078,APPROVED,UNPAID,2025-02-23,,2025-02-23,2025-02-23,1.0,2025-02-23,INTERNAL
ADMIN-EXP-887,ADMIN-FUND-003,Other,Fund,Sanchez-Smith,2022-01-08,76820.75,EUR,Feeling test pass pay. Government share radio walk. Live add similar sport sure.,33971,PAID,UNPAID,2022-01-08,,2022-01-08,2022-01-08,1.0,2022-01-08,INTERNAL
ADMIN-EXP-888,ADMIN-FUND-003,Other,Transaction,Shea-Hamilton,2025-10-14,54915.8,EUR,Author surface report billion almost common seven. Again deal region give no.,82328,PAID,UNPAID,2025-10-14,,2025-10-14,2025-10-14,1.0,2025-10-14,INTERNAL
ADMIN-EXP-889,ADMIN-FUND-003,Legal,Fund,Francis LLC,2021-08-01,107075.44,EUR,Age ball bit drug why treatment. Manage know song must probably size program modern.,78648,PENDING,UNPAID,2021-08-01,,2021-08-01,2021-08-01,1.0,2021-08-01,INTERNAL
ADMIN-EXP-890,ADMIN-FUND-003,Audit,Transaction,Olsen Ltd,2024-09-08,112916.72,EUR,War now key director nothing. Forget difference subject.,72763,PAID,UNPAID,2024-09-08,,2024-09-08,2024-09-08,1.0,2024-09-08,INTERNAL
ADMIN-EXP-891,ADMIN-FUND-003,Travel,Fund,Wright Group,2021-02-28,113571.65,EUR,Stuff build general her appear. Between whom remain all machine never develop.,63834,PENDING,UNPAID,2021-02-28,,2021-02-28,2021-02-28,1.0,2021-02-28,INTERNAL
ADMIN-EXP-892,ADMIN-FUND-003,Legal,Fund,"Strickland, Jennings and Armstrong",2023-01-11,52553.6,EUR,Who speech one modern. Possible card occur knowledge bed particularly quickly.,29710,PENDING,UNPAID,2023-01-11,,2023-01-11,2023-01-11,1.0,2023-01-11,INTERNAL
ADMIN-EXP-893,ADMIN-FUND-003,Other,Transaction,"Duffy, Ingram and Rogers",2021-02-07,102787.8,EUR,Bring act morning important success this ground. Hand economic exist player story often.,55960,PAID,UNPAID,2021-02-07,,2021-02-07,2021-02-07,1.0,2021-02-07,INTERNAL
ADMIN-EXP-894,ADMIN-FUND-003,Audit,Transaction,Reynolds-Snow,2021-04-12,66109.97,EUR,Goal stop three stand carry question. Receive perform easy word.,95959,PAID,UNPAID,2021-04-12,,2021-04-12,2021-04-12,1.0,2021-04-12,INTERNAL
ADMIN-EXP-895,ADMIN-FUND-003,Legal,Transaction,"Jones, Arroyo and Johnson",2021-02-09,24621.69,EUR,Imagine mind teach explain part. Cell night interview loss fast could whatever forward.,28501,PENDING,UNPAID,2021-02-09,,2021-02-09,2021-02-09,1.0,2021-02-09,INTERNAL
ADMIN-EXP-896,ADMIN-FUND-003,Travel,Transaction,Davis-Holden,2022-12-01,77449.69,EUR,Mr herself night. Cell peace outside police hot. Whose cup vote nothing movie officer necessary.,66607,APPROVED,PAID,2022-12-01,,2022-12-01,2022-12-01,1.0,2022-12-01,INTERNAL
ADMIN-EXP-897,ADMIN-FUND-003,Other,Transaction,Guzman-Fernandez,2024-03-06,42398.98,EUR,Draw authority set how marriage above range. Audience head night carry.,65973,PENDING,UNPAID,2024-03-06,,2024-03-06,2024-03-06,1.0,2024-03-06,INTERNAL
ADMIN-EXP-898,ADMIN-FUND-003,Other,Fund,Johnson-Vargas,2020-12-20,39049.72,EUR,Last boy behavior whatever walk agency. Dream where minute our career much.,27890,PENDING,PAID,2020-12-20,,2020-12-20,2020-12-20,1.0,2020-12-20,INTERNAL
ADMIN-EXP-899,ADMIN-FUND-003,Other,Transaction,Haley Ltd,2021-03-15,25431.65,EUR,Plan analysis though rather. Conference change knowledge heart material.,87940,APPROVED,PAID,2021-03-15,,2021-03-15,2021-03-15,1.0,2021-03-15,INTERNAL
ADMIN-EXP-900,ADMIN-FUND-003,Audit,Fund,Greene and Sons,2021-11-02,19622.95,EUR,Bar time kid start catch. Car bar wall direction.,21637,APPROVED,PAID,2021-11-02,,2021-11-02,2021-11-02,1.0,2021-11-02,INTERNAL
ADMIN-EXP-901,ADMIN-FUND-003,Other,Transaction,"Nixon, Russell and Perez",2022-04-16,18777.78,EUR,Rise sense suggest student sister. Commercial over week trial whom.,79903,APPROVED,UNPAID,2022-04-16,,2022-04-16,2022-04-16,1.0,2022-04-16,INTERNAL
ADMIN-EXP-902,ADMIN-FUND-003,Other,Transaction,"Rowe, Short and Glass",2025-03-02,111961.04,EUR,Teach process tree ball reason. People early thing step whom. No more process develop several.,44389,PAID,UNPAID,2025-03-02,,2025-03-02,2025-03-02,1.0,2025-03-02,INTERNAL
ADMIN-EXP-903,ADMIN-FUND-003,Other,Fund,Kaufman-York,2023-02-22,66122.68,EUR,Trip himself sea draw. Bag thousand loss reason popular get loss.,40940,APPROVED,UNPAID,2023-02-22,,2023-02-22,2023-02-22,1.0,2023-02-22,INTERNAL
ADMIN-EXP-904,ADMIN-FUND-003,Other,Transaction,Burgess-Wiley,2024-02-14,65514.75,EUR,Across writer huge job mention watch. Difference all machine let charge thought.,35726,APPROVED,PAID,2024-02-14,,2024-02-14,2024-02-14,1.0,2024-02-14,INTERNAL
ADMIN-EXP-905,ADMIN-FUND-003,Audit,Transaction,Moreno-Taylor,2024-05-21,35592.39,EUR,Prevent direction factor seven. Individual away business player.,53065,PAID,UNPAID,2024-05-21,,2024-05-21,2024-05-21,1.0,2024-05-21,INTERNAL
ADMIN-EXP-906,ADMIN-FUND-003,Legal,Transaction,Turner Inc,2021-12-10,102049.81,EUR,Find yet movie mention none customer whether. Relate itself in hope water. Stay hotel ten never.,91289,APPROVED,UNPAID,2021-12-10,,2021-12-10,2021-12-10,1.0,2021-12-10,INTERNAL
ADMIN-EXP-907,ADMIN-FUND-003,Legal,Fund,"Nguyen, Vazquez and Bryant",2024-10-10,33199.94,EUR,Information happen western fine at.,69203,PAID,PAID,2024-10-10,,2024-10-10,2024-10-10,1.0,2024-10-10,INTERNAL
ADMIN-EXP-908,ADMIN-FUND-003,Other,Transaction,Ford-Larsen,2021-05-16,38856.16,EUR,Candidate become growth crime.,20840,PENDING,UNPAID,2021-05-16,,2021-05-16,2021-05-16,1.0,2021-05-16,INTERNAL
ADMIN-EXP-909,ADMIN-FUND-003,Audit,Transaction,"Ferguson, Mitchell and Reese",2021-08-21,109102.25,EUR,Home throughout high relationship item player. Follow human be yet five than.,45016,APPROVED,UNPAID,2021-08-21,,2021-08-21,2021-08-21,1.0,2021-08-21,INTERNAL
ADMIN-EXP-910,ADMIN-FUND-003,Travel,Fund,Brown-Walsh,2021-08-25,34276.01,EUR,Personal huge property middle pressure control. Story watch water wide present involve.,34404,PAID,PAID,2021-08-25,,2021-08-25,2021-08-25,1.0,2021-08-25,INTERNAL
ADMIN-EXP-911,ADMIN-FUND-003,Audit,Transaction,"Day, Graham and Cole",2023-03-24,14793.6,EUR,So just recognize think.,54863,APPROVED,UNPAID,2023-03-24,,2023-03-24,2023-03-24,1.0,2023-03-24,INTERNAL
ADMIN-EXP-912,ADMIN-FUND-003,Legal,Fund,Johnson-Perry,2022-05-04,88607.43,EUR,Old because sense. Treat not but upon.,30834,APPROVED,PAID,2022-05-04,,2022-05-04,2022-05-04,1.0,2022-05-04,INTERNAL
ADMIN-EXP-913,ADMIN-FUND-003,Other,Transaction,"Davis, Turner and Beltran",2025-01-30,33869.08,EUR,So then player improve. Foreign value body include. Prepare adult main still edge.,12795,PAID,PAID,2025-01-30,,2025-01-30,2025-01-30,1.0,2025-01-30,INTERNAL
ADMIN-EXP-914,ADMIN-FUND-003,Audit,Transaction,"Martin, Hernandez and Durham",2024-06-07,49548.14,EUR,Truth spend TV production. Expert only miss though decision whether available.,10421,APPROVED,PAID,2024-06-07,,2024-06-07,2024-06-07,1.0,2024-06-07,INTERNAL
ADMIN-EXP-915,ADMIN-FUND-003,Legal,Transaction,Blevins-Taylor,2023-05-06,41803.56,EUR,Big buy care wife particular within get. Very me attack your what plan return.,17880,APPROVED,UNPAID,2023-05-06,,2023-05-06,2023-05-06,1.0,2023-05-06,INTERNAL
ADMIN-EXP-916,ADMIN-FUND-003,Travel,Fund,Rodriguez PLC,2024-08-23,26033.21,EUR,Western clear coach past business assume various. Bag gun work low through.,92307,PAID,UNPAID,2024-08-23,,2024-08-23,2024-08-23,1.0,2024-08-23,INTERNAL
ADMIN-EXP-917,ADMIN-FUND-003,Legal,Transaction,"Hill, Skinner and Jones",2024-08-09,14723.63,EUR,Cold strategy big no magazine think industry structure.,48300,APPROVED,PAID,2024-08-09,,2024-08-09,2024-08-09,1.0,2024-08-09,INTERNAL
ADMIN-EXP-918,ADMIN-FUND-003,Travel,Fund,"Oliver, Smith and Barnes",2025-05-16,90092.07,EUR,Professional international this do. Anyone change radio. Bar attention care leader fish push talk.,60398,PAID,PAID,2025-05-16,,2025-05-16,2025-05-16,1.0,2025-05-16,INTERNAL
ADMIN-EXP-919,ADMIN-FUND-003,Legal,Transaction,Williams Inc,2024-03-26,87995.14,EUR,Paper church ok include than. Life pick imagine in by movement leg second.,76901,PAID,PAID,2024-03-26,,2024-03-26,2024-03-26,1.0,2024-03-26,INTERNAL
ADMIN-EXP-920,ADMIN-FUND-003,Audit,Transaction,Franklin LLC,2022-02-21,55007.9,EUR,Wall general really building sign recently. Air out page. Person operation consider road.,48073,APPROVED,PAID,2022-02-21,,2022-02-21,2022-02-21,1.0,2022-02-21,INTERNAL
ADMIN-EXP-921,ADMIN-FUND-003,Legal,Transaction,"Davis, Brown and Jennings",2023-12-13,107563.37,EUR,Letter thank wind general usually. Million former reason. Wait small manager.,64129,PAID,UNPAID,2023-12-13,,2023-12-13,2023-12-13,1.0,2023-12-13,INTERNAL
ADMIN-EXP-922,ADMIN-FUND-003,Audit,Fund,"Lynch, Ramos and Charles",2023-11-14,51112.44,EUR,Five various event other artist yourself glass. Best if dark participant many economic later act.,53599,PAID,PAID,2023-11-14,,2023-11-14,2023-11-14,1.0,2023-11-14,INTERNAL
ADMIN-EXP-923,ADMIN-FUND-003,Legal,Fund,Lopez PLC,2020-12-30,80690.43,EUR,Return poor should leg central. Event trip kid decade ability three chair.,68541,PENDING,UNPAID,2020-12-30,,2020-12-30,2020-12-30,1.0,2020-12-30,INTERNAL
ADMIN-EXP-924,ADMIN-FUND-003,Other,Transaction,Lee-Hooper,2024-02-17,77044.26,EUR,Represent remain wonder about military fall raise provide. Almost card spend more term.,74639,PENDING,UNPAID,2024-02-17,,2024-02-17,2024-02-17,1.0,2024-02-17,INTERNAL
ADMIN-EXP-925,ADMIN-FUND-003,Travel,Transaction,Mcfarland-Ellison,2022-08-04,42672.9,EUR,News five recognize civil later. Authority same class focus. Letter run daughter.,25397,APPROVED,PAID,2022-08-04,,2022-08-04,2022-08-04,1.0,2022-08-04,INTERNAL
ADMIN-EXP-926,ADMIN-FUND-003,Other,Fund,Hart-Mayer,2022-12-05,99438.3,EUR,Smile deep little wrong. Bed send outside if today official.,86912,APPROVED,UNPAID,2022-12-05,,2022-12-05,2022-12-05,1.0,2022-12-05,INTERNAL
ADMIN-EXP-927,ADMIN-FUND-003,Other,Fund,"Mcbride, Preston and Rubio",2022-06-21,15988.4,EUR,Blood entire quality. Lead big red happen possible whether seat. Service travel western never.,18142,PAID,UNPAID,2022-06-21,,2022-06-21,2022-06-21,1.0,2022-06-21,INTERNAL
ADMIN-EXP-928,ADMIN-FUND-003,Audit,Transaction,Moore-Stewart,2020-11-28,74270.26,EUR,Religious hospital yes onto. Rich month character maintain.,47251,PAID,UNPAID,2020-11-28,,2020-11-28,2020-11-28,1.0,2020-11-28,INTERNAL
ADMIN-EXP-929,ADMIN-FUND-003,Other,Transaction,"Craig, Allen and Johnson",2022-08-15,103924.53,EUR,Party team century field. Word great improve over appear. Somebody add never around investment.,23831,PENDING,UNPAID,2022-08-15,,2022-08-15,2022-08-15,1.0,2022-08-15,INTERNAL
ADMIN-EXP-930,ADMIN-FUND-003,Travel,Transaction,"Hill, Price and Miles",2025-01-25,93094.93,EUR,Tax heart read daughter later. Organization worker response moment summer approach.,96375,PENDING,PAID,2025-01-25,,2025-01-25,2025-01-25,1.0,2025-01-25,INTERNAL
ADMIN-EXP-931,ADMIN-FUND-003,Audit,Transaction,Simpson-Flores,2024-12-12,72898.05,EUR,Rise plan many event between. Writer admit forward will else official.,55024,APPROVED,PAID,2024-12-12,,2024-12-12,2024-12-12,1.0,2024-12-12,INTERNAL
ADMIN-EXP-932,ADMIN-FUND-003,Travel,Fund,"Irwin, Rivera and Joseph",2025-07-21,81108.68,EUR,Summer develop quite Mrs. Look worry color community meet investment.,65080,APPROVED,UNPAID,2025-07-21,,2025-07-21,2025-07-21,1.0,2025-07-21,INTERNAL
ADMIN-EXP-933,ADMIN-FUND-003,Legal,Fund,"Brown, Woodard and Williams",2022-03-10,17626.91,EUR,Appear trouble cell rule service research fish.,58733,PAID,PAID,2022-03-10,,2022-03-10,2022-03-10,1.0,2022-03-10,INTERNAL
ADMIN-EXP-934,ADMIN-FUND-003,Legal,Fund,"Thompson, Sandoval and Simmons",2022-06-18,25088.4,EUR,There technology friend their effect character. Provide before event throw find group them.,36818,APPROVED,PAID,2022-06-18,,2022-06-18,2022-06-18,1.0,2022-06-18,INTERNAL
ADMIN-EXP-935,ADMIN-FUND-003,Other,Transaction,"Stevenson, Hill and Davis",2024-11-26,19134.47,EUR,Certainly short blue camera decade field next. Watch indeed mean compare fish environmental.,90096,PAID,PAID,2024-11-26,,2024-11-26,2024-11-26,1.0,2024-11-26,INTERNAL
ADMIN-EXP-936,ADMIN-FUND-003,Travel,Fund,Suarez and Sons,2021-12-19,108328.82,EUR,Hope tend image station. Run area best table agent life. Dinner summer class improve under.,66810,APPROVED,UNPAID,2021-12-19,,2021-12-19,2021-12-19,1.0,2021-12-19,INTERNAL
ADMIN-EXP-937,ADMIN-FUND-003,Legal,Fund,"Hamilton, Jackson and Campbell",2022-07-08,105250.42,EUR,Per hair discussion age drive support Mrs show. Voice involve four far cell act somebody.,97253,PAID,PAID,2022-07-08,,2022-07-08,2022-07-08,1.0,2022-07-08,INTERNAL
ADMIN-EXP-938,ADMIN-FUND-003,Other,Fund,Rojas PLC,2022-10-07,108649.41,EUR,Former every each local even. Effort economy choice have cause carry.,18229,PAID,PAID,2022-10-07,,2022-10-07,2022-10-07,1.0,2022-10-07,INTERNAL
ADMIN-EXP-939,ADMIN-FUND-003,Audit,Transaction,Gallagher Ltd,2022-11-07,109544.87,EUR,Technology position though you while executive somebody. Art effect woman politics.,68955,PAID,PAID,2022-11-07,,2022-11-07,2022-11-07,1.0,2022-11-07,INTERNAL
ADMIN-EXP-940,ADMIN-FUND-003,Other,Transaction,Marks-Suarez,2021-08-04,57513.41,EUR,Official decade loss president when once consumer. Character five road little fast.,42566,PAID,UNPAID,2021-08-04,,2021-08-04,2021-08-04,1.0,2021-08-04,INTERNAL
ADMIN-EXP-941,ADMIN-FUND-003,Travel,Fund,Taylor-Williams,2021-01-30,68653.48,EUR,Serve spring buy tell student development area mouth. Certain structure bank control talk.,49187,PAID,PAID,2021-01-30,,2021-01-30,2021-01-30,1.0,2021-01-30,INTERNAL
ADMIN-EXP-942,ADMIN-FUND-003,Audit,Fund,"Briggs, Robinson and Davis",2024-10-08,88571.5,EUR,Under detail any. Heavy person put how. Available much list majority usually.,63052,PENDING,UNPAID,2024-10-08,,2024-10-08,2024-10-08,1.0,2024-10-08,INTERNAL
ADMIN-EXP-943,ADMIN-FUND-003,Other,Transaction,"Rocha, Goodman and Willis",2024-04-26,28022.8,EUR,After out expect right. Live green step whether.,16875,APPROVED,UNPAID,2024-04-26,,2024-04-26,2024-04-26,1.0,2024-04-26,INTERNAL
ADMIN-EXP-944,ADMIN-FUND-003,Travel,Transaction,Ponce Group,2024-08-24,84985.97,EUR,Product like million. West which economic third. Study full turn significant.,45368,APPROVED,UNPAID,2024-08-24,,2024-08-24,2024-08-24,1.0,2024-08-24,INTERNAL
ADMIN-EXP-945,ADMIN-FUND-003,Legal,Fund,Ferguson PLC,2022-01-09,65753.83,EUR,Test school once effect rise work wind. Appear father happen visit alone.,74479,PENDING,UNPAID,2022-01-09,,2022-01-09,2022-01-09,1.0,2022-01-09,INTERNAL
ADMIN-EXP-946,ADMIN-FUND-003,Travel,Fund,"Grimes, Johnson and Spencer",2023-01-12,107109.95,EUR,Site bring instead ahead current. Require over quickly purpose idea throw bag.,53214,PENDING,UNPAID,2023-01-12,,2023-01-12,2023-01-12,1.0,2023-01-12,INTERNAL
ADMIN-EXP-947,ADMIN-FUND-003,Audit,Transaction,Jackson Ltd,2021-12-18,80544.95,EUR,Front me according raise effort ask. Skill effect buy best.,95423,PAID,UNPAID,2021-12-18,,2021-12-18,2021-12-18,1.0,2021-12-18,INTERNAL
ADMIN-EXP-948,ADMIN-FUND-003,Other,Transaction,Patrick LLC,2021-03-08,70447.96,EUR,Thought assume candidate but. Provide police interesting brother religious carry number treatment.,10279,APPROVED,UNPAID,2021-03-08,,2021-03-08,2021-03-08,1.0,2021-03-08,INTERNAL
ADMIN-EXP-949,ADMIN-FUND-003,Legal,Fund,Weaver Group,2023-12-03,105942.11,EUR,Bar kind floor improve miss real education. Character energy hot hit.,93519,PAID,UNPAID,2023-12-03,,2023-12-03,2023-12-03,1.0,2023-12-03,INTERNAL
ADMIN-EXP-950,ADMIN-FUND-003,Legal,Transaction,Rodriguez LLC,2025-07-27,29395.84,EUR,Late debate book attack. Star wish draw day personal expect local.,89054,APPROVED,UNPAID,2025-07-27,,2025-07-27,2025-07-27,1.0,2025-07-27,INTERNAL
ADMIN-EXP-951,ADMIN-FUND-003,Other,Transaction,Newman-Ferguson,2023-11-08,72323.59,EUR,Drop teach director occur treat skill near.,63271,PENDING,PAID,2023-11-08,,2023-11-08,2023-11-08,1.0,2023-11-08,INTERNAL
ADMIN-EXP-952,ADMIN-FUND-003,Travel,Transaction,Cortez Ltd,2023-12-10,16180.27,EUR,Sing special result other network it. Finish research water success computer.,33617,PENDING,UNPAID,2023-12-10,,2023-12-10,2023-12-10,1.0,2023-12-10,INTERNAL
ADMIN-EXP-953,ADMIN-FUND-003,Legal,Transaction,Hernandez Group,2025-04-11,35842.59,EUR,Cover history condition win important sound. Market else threat lawyer.,76034,APPROVED,PAID,2025-04-11,,2025-04-11,2025-04-11,1.0,2025-04-11,INTERNAL
ADMIN-EXP-954,ADMIN-FUND-003,Legal,Transaction,"Moore, Snow and Anderson",2024-01-23,62199.2,EUR,Sometimes everything phone other most citizen product.,58009,APPROVED,PAID,2024-01-23,,2024-01-23,2024-01-23,1.0,2024-01-23,INTERNAL
ADMIN-EXP-955,ADMIN-FUND-003,Other,Fund,Hansen LLC,2025-08-02,15369.67,EUR,Everyone four sign receive back. Expect speak serious enjoy artist happy there.,30072,APPROVED,PAID,2025-08-02,,2025-08-02,2025-08-02,1.0,2025-08-02,INTERNAL
ADMIN-EXP-956,ADMIN-FUND-003,Other,Transaction,Gilbert and Sons,2023-07-24,48200.94,EUR,Fight ago hair teacher rock. Want need past doctor whom.,36367,PENDING,PAID,2023-07-24,,2023-07-24,2023-07-24,1.0,2023-07-24,INTERNAL
ADMIN-EXP-957,ADMIN-FUND-003,Other,Fund,Campbell PLC,2024-03-24,110928.38,EUR,Food past at. Improve ever feeling suffer these leg. Also dream fall. Source long family cell tree.,30315,APPROVED,UNPAID,2024-03-24,,2024-03-24,2024-03-24,1.0,2024-03-24,INTERNAL
ADMIN-EXP-958,ADMIN-FUND-003,Legal,Fund,Berger-Nelson,2024-06-07,58632.68,EUR,Hair family success. Consumer statement stay watch among music shoulder.,42625,APPROVED,PAID,2024-06-07,,2024-06-07,2024-06-07,1.0,2024-06-07,INTERNAL
ADMIN-EXP-959,ADMIN-FUND-003,Other,Transaction,"Kirby, Valdez and Santana",2023-06-29,49424.72,EUR,Fish the laugh loss. Room treat current seven. Week born yourself book no cover worker.,15666,APPROVED,PAID,2023-06-29,,2023-06-29,2023-06-29,1.0,2023-06-29,INTERNAL
ADMIN-EXP-960,ADMIN-FUND-003,Other,Fund,Donovan and Sons,2024-09-06,104718.53,EUR,After past cell apply against fish. Quite thought follow assume notice civil paper.,56635,PENDING,PAID,2024-09-06,,2024-09-06,2024-09-06,1.0,2024-09-06,INTERNAL
ADMIN-EXP-961,ADMIN-FUND-003,Travel,Transaction,Wu-Hines,2023-06-19,59654.63,EUR,Minute organization lead. Manager court news company edge admit enter.,53484,PENDING,PAID,2023-06-19,,2023-06-19,2023-06-19,1.0,2023-06-19,INTERNAL
ADMIN-EXP-962,ADMIN-FUND-003,Audit,Fund,"Rojas, Castro and Wilson",2024-01-01,92191.5,EUR,Decision again tell. Leave arm film image which forward them eye. Next news friend.,22914,APPROVED,PAID,2024-01-01,,2024-01-01,2024-01-01,1.0,2024-01-01,INTERNAL
ADMIN-EXP-963,ADMIN-FUND-003,Audit,Transaction,Peters Inc,2024-09-29,91754.65,EUR,Word thing main sure central. Campaign during believe short list trip.,42481,APPROVED,UNPAID,2024-09-29,,2024-09-29,2024-09-29,1.0,2024-09-29,INTERNAL
ADMIN-EXP-964,ADMIN-FUND-003,Travel,Fund,"Hood, Savage and Wright",2024-09-03,45856.63,EUR,Notice real able throw wife very but. Dog seat throughout across. Choose spring really moment wind.,58274,PAID,UNPAID,2024-09-03,,2024-09-03,2024-09-03,1.0,2024-09-03,INTERNAL
ADMIN-EXP-965,ADMIN-FUND-003,Other,Fund,Glass Ltd,2024-09-22,14575.53,EUR,Break national Republican their. Civil college rest wait spend environment receive.,80812,PENDING,PAID,2024-09-22,,2024-09-22,2024-09-22,1.0,2024-09-22,INTERNAL
ADMIN-EXP-966,ADMIN-FUND-003,Audit,Fund,King Inc,2023-07-16,59369.44,EUR,Same despite hit civil.,68847,APPROVED,PAID,2023-07-16,,2023-07-16,2023-07-16,1.0,2023-07-16,INTERNAL
ADMIN-EXP-967,ADMIN-FUND-003,Other,Fund,"Scott, Smith and Sanchez",2025-04-10,97131.15,EUR,Time beat to best staff.,45331,PENDING,PAID,2025-04-10,,2025-04-10,2025-04-10,1.0,2025-04-10,INTERNAL
ADMIN-EXP-968,ADMIN-FUND-003,Audit,Transaction,"Williams, Mathis and Jackson",2022-03-06,29006.21,EUR,History should simple important. Effort night according born adult.,33892,PENDING,PAID,2022-03-06,,2022-03-06,2022-03-06,1.0,2022-03-06,INTERNAL
