expense_id,fund_code,expense_type,expense_category,vendor_name,expense_date,expense_amount,expense_currency,description,invoice_number,approval_status,payment_status,payment_date,allocated_to_investments,created_date,last_modified_date,fx_rate,fx_rate_as_of,fx_rate_source
ADMIN-EXP-433,ADMIN-FUND-001,Audit,Transaction,"Buckley, Madden and Moss",2024-03-29,141028.52,EUR,Condition data any without happen cup. Keep chance stop.,66099,APPROVED,UNPAID,2024-03-29,,2024-03-29,2024-03-29,1.0,2024-03-29,INTERNAL
ADMIN-EXP-434,ADMIN-FUND-001,Other,Fund,Faulkner LLC,2025-01-18,253413.56,EUR,Price too why realize. Window evidence weight necessary bring all myself floor.,68261,PAID,UNPAID,2025-01-18,,2025-01-18,2025-01-18,1.0,2025-01-18,INTERNAL
ADMIN-EXP-435,ADMIN-FUND-001,Legal,Transaction,Cochran and Sons,2021-11-27,223200.71,EUR,Reality modern serve billion now. Shoulder food particular.,44729,PENDING,UNPAID,2021-11-27,,2021-11-27,2021-11-27,1.0,2021-11-27,INTERNAL
ADMIN-EXP-436,ADMIN-FUND-001,Audit,Transaction,Edwards-Gross,2022-05-17,185014.75,EUR,Onto find tend hard name entire follow. Institution simply quality.,47389,PAID,UNPAID,2022-05-17,,2022-05-17,2022-05-17,1.0,2022-05-17,INTERNAL
ADMIN-EXP-437,ADMIN-FUND-001,Audit,Fund,Merritt-Ferguson,2025-01-13,137429.2,EUR,Indicate somebody much truth leader. Hit consumer describe prove.,70253,PENDING,PAID,2025-01-13,,2025-01-13,2025-01-13,1.0,2025-01-13,INTERNAL
ADMIN-EXP-438,ADMIN-FUND-001,Travel,Transaction,Wallace and Sons,2021-08-03,124168.46,EUR,Keep camera same themselves month. Expert time four. Main wear better place keep research.,65036,PAID,UNPAID,2021-08-03,,2021-08-03,2021-08-03,1.0,2021-08-03,INTERNAL
ADMIN-EXP-439,ADMIN-FUND-001,Legal,Transaction,Gonzalez Inc,2024-03-26,236827.84,EUR,Power science cost include issue beautiful. Growth health environmental never nice.,12952,PENDING,UNPAID,2024-03-26,,2024-03-26,2024-03-26,1.0,2024-03-26,INTERNAL
ADMIN-EXP-440,ADMIN-FUND-001,Audit,Fund,Short Group,2023-03-12,105229.26,EUR,Pm already son away painting already. According others involve green.,68346,PENDING,PAID,2023-03-12,,2023-03-12,2023-03-12,1.0,2023-03-12,INTERNAL
ADMIN-EXP-441,ADMIN-FUND-001,Other,Transaction,Parks-Summers,2023-03-05,248773.92,EUR,Similar cup board yeah health similar hundred. Animal language physical quickly.,76941,PAID,UNPAID,2023-03-05,,2023-03-05,2023-03-05,1.0,2023-03-05,INTERNAL
ADMIN-EXP-442,ADMIN-FUND-001,Other,Fund,Collier-Lucas,2022-12-12,98821.63,EUR,Cell issue rate green suggest win. Material make sure bag you. Church hear of.,70497,PAID,UNPAID,2022-12-12,,2022-12-12,2022-12-12,1.0,2022-12-12,INTERNAL
ADMIN-EXP-443,ADMIN-FUND-001,Other,Fund,"Rojas, Pittman and Martin",2023-07-28,198572.95,EUR,South between type. Rock after probably phone you.,12073,PAID,UNPAID,2023-07-28,,2023-07-28,2023-07-28,1.0,2023-07-28,INTERNAL
ADMIN-EXP-444,ADMIN-FUND-001,Travel,Transaction,"Castillo, Cobb and Mccormick",2021-10-26,127627.08,EUR,Product fast none act late. Against others kind factor. Party close now at.,88695,PAID,UNPAID,2021-10-26,,2021-10-26,2021-10-26,1.0,2021-10-26,INTERNAL
ADMIN-EXP-445,ADMIN-FUND-001,Legal,Transaction,Harrison-Berry,2025-09-19,200943.45,EUR,Short stop sea direction question go. Go bring challenge side expert try.,40496,PAID,PAID,2025-09-19,,2025-09-19,2025-09-19,1.0,2025-09-19,INTERNAL
ADMIN-EXP-446,ADMIN-FUND-001,Travel,Fund,Morris Group,2025-10-16,149155.24,EUR,Tax people score decide real. Choose clear PM some. Hour PM behind process.,47456,APPROVED,UNPAID,2025-10-16,,2025-10-16,2025-10-16,1.0,2025-10-16,INTERNAL
ADMIN-EXP-447,ADMIN-FUND-001,Other,Fund,"Morales, Anderson and Barnett",2024-04-02,178733.07,EUR,Identify use research them theory dark. Friend check when many moment effort.,65355,APPROVED,PAID,2024-04-02,,2024-04-02,2024-04-02,1.0,2024-04-02,INTERNAL
ADMIN-EXP-448,ADMIN-FUND-001,Audit,Fund,Cochran LLC,2025-06-08,116062.44,EUR,Teacher here piece central. Soon skill commercial. Interest production side ground staff miss trip.,38348,APPROVED,UNPAID,2025-06-08,,2025-06-08,2025-06-08,1.0,2025-06-08,INTERNAL
ADMIN-EXP-449,ADMIN-FUND-001,Legal,Transaction,Schultz-Meadows,2023-09-14,146395.81,EUR,Expert successful his cost house middle particularly. Create baby think clear employee soldier.,69122,APPROVED,PAID,2023-09-14,,2023-09-14,2023-09-14,1.0,2023-09-14,INTERNAL
ADMIN-EXP-450,ADMIN-FUND-001,Other,Transaction,"Baker, Harris and Ramirez",2023-09-13,210176.29,EUR,Bed most laugh young local.,33306,APPROVED,PAID,2023-09-13,,2023-09-13,2023-09-13,1.0,2023-09-13,INTERNAL
ADMIN-EXP-451,ADMIN-FUND-001,Legal,Fund,"Watson, Chavez and Benson",2021-01-09,105911.43,EUR,Information politics show up guy leader. Rise onto live wind base. Front item foot again.,84965,APPROVED,PAID,2021-01-09,,2021-01-09,2021-01-09,1.0,2021-01-09,INTERNAL
ADMIN-EXP-452,ADMIN-FUND-001,Legal,Fund,Monroe LLC,2021-09-15,257454.05,EUR,Detail structure actually data themselves fast myself. Week remember audience.,18523,PENDING,UNPAID,2021-09-15,,2021-09-15,2021-09-15,1.0,2021-09-15,INTERNAL
ADMIN-EXP-453,ADMIN-FUND-001,Audit,Fund,"Brown, Wilson and Stevens",2024-10-01,197501.4,EUR,Sport opportunity great break yes system soon. His teach risk because structure.,32681,PENDING,PAID,2024-10-01,,2024-10-01,2024-10-01,1.0,2024-10-01,INTERNAL
ADMIN-EXP-454,ADMIN-FUND-001,Audit,Transaction,"Rodriguez, Escobar and Ortiz",2025-03-27,207064.66,EUR,Work beat development think stop artist blood. Remember high oil age.,41740,APPROVED,PAID,2025-03-27,,2025-03-27,2025-03-27,1.0,2025-03-27,INTERNAL
ADMIN-EXP-455,ADMIN-FUND-001,Legal,Transaction,Key Ltd,2024-11-02,69438.78,EUR,Wife important tend anyone. Garden million without.,35322,PENDING,PAID,2024-11-02,,2024-11-02,2024-11-02,1.0,2024-11-02,INTERNAL
ADMIN-EXP-456,ADMIN-FUND-002,Travel,Transaction,Davis-Bailey,2023-07-18,193416.8,USD,Strong work kitchen sell recently list mother officer. Institution common pay sea.,26507,APPROVED,PAID,2023-07-18,,2023-07-18,2023-07-18,1.0,2023-07-18,INTERNAL
ADMIN-EXP-457,ADMIN-FUND-002,Other,Transaction,Mcgrath-Shaffer,2022-04-06,214145.56,USD,Town daughter gun mean. Particular drug leg today staff.,62705,APPROVED,UNPAID,2022-04-06,,2022-04-06,2022-04-06,1.0,2022-04-06,INTERNAL
ADMIN-EXP-458,ADMIN-FUND-002,Other,Fund,Henry and Sons,2021-02-15,34666.83,USD,Activity remember task. Side result and throw site color. Among teach must mind cost.,35369,PAID,UNPAID,2021-02-15,,2021-02-15,2021-02-15,1.0,2021-02-15,INTERNAL
ADMIN-EXP-459,ADMIN-FUND-002,Legal,Fund,Barnes and Sons,2023-01-11,30795.91,USD,Year health after base cup career. Section write Democrat feeling believe toward experience.,84541,APPROVED,PAID,2023-01-11,,2023-01-11,2023-01-11,1.0,2023-01-11,INTERNAL
ADMIN-EXP-460,ADMIN-FUND-002,Audit,Transaction,Wright-Lopez,2022-02-06,54472.68,USD,Story put son capital not safe. Decide arm avoid question.,27389,PAID,UNPAID,2022-02-06,,2022-02-06,2022-02-06,1.0,2022-02-06,INTERNAL
ADMIN-EXP-461,ADMIN-FUND-002,Travel,Fund,Smith-Benson,2025-07-15,57724.88,USD,Five natural national old soldier. Quality wall threat.,16111,PAID,UNPAID,2025-07-15,,2025-07-15,2025-07-15,1.0,2025-07-15,INTERNAL
ADMIN-EXP-462,ADMIN-FUND-002,Other,Fund,Clark-Wall,2025-07-08,205581.24,USD,Subject community teach research. Year table defense next well simply authority.,28094,PAID,PAID,2025-07-08,,2025-07-08,2025-07-08,1.0,2025-07-08,INTERNAL
ADMIN-EXP-463,ADMIN-FUND-002,Legal,Fund,Ford-George,2025-04-26,139773.94,USD,But who ground reality. Hold describe capital defense card.,11195,PENDING,UNPAID,2025-04-26,,2025-04-26,2025-04-26,1.0,2025-04-26,INTERNAL
ADMIN-EXP-464,ADMIN-FUND-002,Audit,Transaction,"Beasley, Garcia and Andrews",2021-02-25,209081.59,USD,Various affect together attorney. Probably Congress food different test college crime present.,20438,PAID,PAID,2021-02-25,,2021-02-25,2021-02-25,1.0,2021-02-25,INTERNAL
ADMIN-EXP-465,ADMIN-FUND-002,Legal,Fund,Miller-Bush,2024-08-11,94425.62,USD,Very manager thus. Already sea hair receive. What according save to ready thought go.,43600,PAID,UNPAID,2024-08-11,,2024-08-11,2024-08-11,1.0,2024-08-11,INTERNAL
ADMIN-EXP-466,ADMIN-FUND-002,Travel,Fund,Washington Inc,2021-09-20,218719.11,USD,Degree able heart girl.,84650,PENDING,UNPAID,2021-09-20,,2021-09-20,2021-09-20,1.0,2021-09-20,INTERNAL
ADMIN-EXP-467,ADMIN-FUND-002,Legal,Transaction,Frey-Quinn,2025-05-26,120491.72,USD,Cold guy friend. Produce bag effort behavior instead. National traditional get unit.,83840,PAID,PAID,2025-05-26,,2025-05-26,2025-05-26,1.0,2025-05-26,INTERNAL
ADMIN-EXP-468,ADMIN-FUND-002,Travel,Transaction,Solis Group,2023-10-14,116671.38,USD,Some stock of north green. Thing often color.,83504,APPROVED,UNPAID,2023-10-14,,2023-10-14,2023-10-14,1.0,2023-10-14,INTERNAL
ADMIN-EXP-469,ADMIN-FUND-002,Other,Transaction,Wall-Wilson,2025-04-16,71582.0,USD,Social more single control task speak sign. Sure fund address.,17378,PAID,UNPAID,2025-04-16,,2025-04-16,2025-04-16,1.0,2025-04-16,INTERNAL
ADMIN-EXP-470,ADMIN-FUND-002,Travel,Fund,Smith-Burns,2021-09-22,160073.03,USD,Leader own within fall treat fill view everyone. Opportunity write break finally member sometimes.,61621,PENDING,PAID,2021-09-22,,2021-09-22,2021-09-22,1.0,2021-09-22,INTERNAL
ADMIN-EXP-471,ADMIN-FUND-002,Audit,Transaction,Gould-Burns,2021-04-13,191509.93,USD,Put play bad project American.,79300,PAID,UNPAID,2021-04-13,,2021-04-13,2021-04-13,1.0,2021-04-13,INTERNAL
ADMIN-EXP-472,ADMIN-FUND-002,Audit,Transaction,Patrick-Burton,2021-02-17,166324.74,USD,Today meet per seem provide. Way southern continue money color. Level energy help until.,29562,PAID,PAID,2021-02-17,,2021-02-17,2021-02-17,1.0,2021-02-17,INTERNAL
ADMIN-EXP-473,ADMIN-FUND-002,Travel,Fund,"Warren, Rodgers and Ramirez",2023-10-02,133678.86,USD,I majority effort continue. Culture real imagine special data doctor road.,31594,PAID,PAID,2023-10-02,,2023-10-02,2023-10-02,1.0,2023-10-02,INTERNAL
ADMIN-EXP-474,ADMIN-FUND-002,Legal,Fund,"Gordon, Wright and Randolph",2021-07-20,59423.91,USD,However as anything draw mean. Trial list minute idea.,58957,APPROVED,PAID,2021-07-20,,2021-07-20,2021-07-20,1.0,2021-07-20,INTERNAL
ADMIN-EXP-475,ADMIN-FUND-002,Audit,Transaction,Herrera-Thompson,2023-05-13,135607.0,USD,Quickly evidence make yet. Support no yet effort. Black worker tell also no serious.,49062,PAID,UNPAID,2023-05-13,,2023-05-13,2023-05-13,1.0,2023-05-13,INTERNAL
ADMIN-EXP-476,ADMIN-FUND-002,Other,Transaction,Novak-Johnson,2023-02-03,129047.79,USD,Building look military pay. New tree tree service rich while just in.,90060,PENDING,UNPAID,2023-02-03,,2023-02-03,2023-02-03,1.0,2023-02-03,INTERNAL
ADMIN-EXP-477,ADMIN-FUND-002,Travel,Transaction,"Gutierrez, Castaneda and Mendez",2024-12-31,180436.34,USD,Prove senior six hour the front fire.,38176,PENDING,PAID,2024-12-31,,2024-12-31,2024-12-31,1.0,2024-12-31,INTERNAL
ADMIN-EXP-478,ADMIN-FUND-002,Other,Transaction,Lee-Miller,2023-02-14,139230.87,USD,Individual head dog modern. Spend financial relate weight.,84412,PAID,UNPAID,2023-02-14,,2023-02-14,2023-02-14,1.0,2023-02-14,INTERNAL
ADMIN-EXP-479,ADMIN-FUND-002,Legal,Fund,"Newton, Lawson and Suarez",2023-05-15,189464.31,USD,Give tell window kind available race. Who apply between human.,76342,APPROVED,UNPAID,2023-05-15,,2023-05-15,2023-05-15,1.0,2023-05-15,INTERNAL
ADMIN-EXP-480,ADMIN-FUND-002,Travel,Fund,Santiago-Livingston,2025-10-07,210569.3,USD,Business realize food although right. Experience apply example fact letter control apply case.,82554,APPROVED,PAID,2025-10-07,,2025-10-07,2025-10-07,1.0,2025-10-07,INTERNAL
ADMIN-EXP-481,ADMIN-FUND-002,Audit,Fund,Baird-Wiggins,2021-02-09,116298.14,USD,Buy education something dream national word wait all. Including wear participant boy tough nice.,41720,PENDING,UNPAID,2021-02-09,,2021-02-09,2021-02-09,1.0,2021-02-09,INTERNAL
ADMIN-EXP-482,ADMIN-FUND-002,Other,Fund,Jones-Powell,2023-07-27,214280.21,USD,Red tell past to.,52768,PENDING,UNPAID,2023-07-27,,2023-07-27,2023-07-27,1.0,2023-07-27,INTERNAL
ADMIN-EXP-483,ADMIN-FUND-002,Legal,Transaction,Burke and Sons,2023-06-23,77581.11,USD,Size firm south address. Throughout but finish lay method.,30216,PENDING,PAID,2023-06-23,,2023-06-23,2023-06-23,1.0,2023-06-23,INTERNAL
ADMIN-EXP-484,ADMIN-FUND-002,Other,Transaction,"Horn, Brock and Perez",2022-05-13,199729.84,USD,As practice there main early. Point happy cell eight. Hard throw gun involve as stand.,62808,PAID,PAID,2022-05-13,,2022-05-13,2022-05-13,1.0,2022-05-13,INTERNAL
ADMIN-EXP-485,ADMIN-FUND-002,Travel,Fund,Thornton PLC,2023-01-12,154396.71,USD,Exist represent somebody suggest each share simple. Pull peace me same adult recognize movie.,37028,PENDING,UNPAID,2023-01-12,,2023-01-12,2023-01-12,1.0,2023-01-12,INTERNAL
ADMIN-EXP-486,ADMIN-FUND-002,Other,Transaction,"Arroyo, Bowen and Wise",2022-02-04,116566.39,USD,Offer value answer line. Drug they garden country agree also serve.,66934,PENDING,UNPAID,2022-02-04,,2022-02-04,2022-02-04,1.0,2022-02-04,INTERNAL
ADMIN-EXP-487,ADMIN-FUND-002,Audit,Fund,"Carpenter, Roberts and Jones",2021-06-09,124853.19,USD,Game word town animal hundred thus treat.,57401,PENDING,UNPAID,2021-06-09,,2021-06-09,2021-06-09,1.0,2021-06-09,INTERNAL
ADMIN-EXP-488,ADMIN-FUND-002,Audit,Fund,"Delgado, Curry and Smith",2021-09-29,156300.84,USD,Around cultural huge travel. Race power same peace picture until throw bar.,50097,APPROVED,UNPAID,2021-09-29,,2021-09-29,2021-09-29,1.0,2021-09-29,INTERNAL
ADMIN-EXP-489,ADMIN-FUND-002,Other,Transaction,Smith Inc,2022-10-20,48941.15,USD,Bag tend determine bed citizen notice. Arrive western far.,63808,PAID,PAID,2022-10-20,,2022-10-20,2022-10-20,1.0,2022-10-20,INTERNAL
ADMIN-EXP-490,ADMIN-FUND-002,Legal,Transaction,Gibson-Schneider,2025-01-08,182107.78,USD,Above firm degree enough deep enough stand. Skin support able. Hotel shoulder glass energy.,17047,PENDING,UNPAID,2025-01-08,,2025-01-08,2025-01-08,1.0,2025-01-08,INTERNAL
ADMIN-EXP-491,ADMIN-FUND-002,Travel,Transaction,Holden and Sons,2021-12-02,201597.22,USD,Name trade situation. Network wind sport writer actually.,55321,APPROVED,UNPAID,2021-12-02,,2021-12-02,2021-12-02,1.0,2021-12-02,INTERNAL
ADMIN-EXP-492,ADMIN-FUND-002,Other,Transaction,Smith PLC,2022-06-26,53569.3,USD,Yourself too wind tree campaign free usually. Dark president boy actually share very move.,16678,PAID,PAID,2022-06-26,,2022-06-26,2022-06-26,1.0,2022-06-26,INTERNAL
ADMIN-EXP-493,ADMIN-FUND-002,Legal,Transaction,Becker PLC,2025-03-13,157261.23,USD,Continue same meeting fly receive impact. Ago us movement goal base.,70600,PENDING,PAID,2025-03-13,,2025-03-13,2025-03-13,1.0,2025-03-13,INTERNAL
ADMIN-EXP-494,ADMIN-FUND-002,Audit,Transaction,Hughes-Davis,2021-07-07,76649.82,USD,Cause live day bill under front. Candidate shoulder subject treatment.,19405,PAID,UNPAID,2021-07-07,,2021-07-07,2021-07-07,1.0,2021-07-07,INTERNAL
ADMIN-EXP-495,ADMIN-FUND-002,Other,Fund,Watkins-Jones,2021-12-02,63161.18,USD,Political quite bag college officer standard dog. Mind example work report purpose care.,57878,PENDING,UNPAID,2021-12-02,,2021-12-02,2021-12-02,1.0,2021-12-02,INTERNAL
ADMIN-EXP-496,ADMIN-FUND-002,Legal,Transaction,Smith-Fox,2025-08-09,33651.09,USD,Soldier wife series. Safe coach play television end best pay home.,89755,PENDING,PAID,2025-08-09,,2025-08-09,2025-08-09,1.0,2025-08-09,INTERNAL
ADMIN-EXP-497,ADMIN-FUND-002,Legal,Transaction,"Johnson, Melton and Roy",2025-09-14,98158.35,USD,World my tonight interest. Vote day remain level.,98841,APPROVED,PAID,2025-09-14,,2025-09-14,2025-09-14,1.0,2025-09-14,INTERNAL
ADMIN-EXP-498,ADMIN-FUND-002,Legal,Transaction,"Wheeler, Sweeney and Randolph",2021-07-24,178512.36,USD,Growth support mean lay whom. Power energy pressure positive staff best itself.,60229,PENDING,UNPAID,2021-07-24,,2021-07-24,2021-07-24,1.0,2021-07-24,INTERNAL
ADMIN-EXP-499,ADMIN-FUND-002,Legal,Transaction,Marshall PLC,2022-08-04,137170.63,USD,Prevent would stock newspaper product green soon.,88300,APPROVED,UNPAID,2022-08-04,,2022-08-04,2022-08-04,1.0,2022-08-04,INTERNAL
ADMIN-EXP-500,ADMIN-FUND-002,Legal,Transaction,"Malone, Marks and Fisher",2024-01-20,209344.51,USD,Environmental stand rock ability fund president book.,30459,APPROVED,UNPAID,2024-01-20,,2024-01-20,2024-01-20,1.0,2024-01-20,INTERNAL
ADMIN-EXP-501,ADMIN-FUND-002,Travel,Transaction,Strong-Parker,2022-07-27,117605.35,USD,Anything voice speak list machine city. Mouth machine leader drug today.,98716,APPROVED,UNPAID,2022-07-27,,2022-07-27,2022-07-27,1.0,2022-07-27,INTERNAL
ADMIN-EXP-502,ADMIN-FUND-002,Other,Transaction,Johnson Ltd,2024-09-13,228542.86,USD,Support her whatever growth ground catch meeting. Food his music agency what several environment.,58236,PAID,UNPAID,2024-09-13,,2024-09-13,2024-09-13,1.0,2024-09-13,INTERNAL
ADMIN-EXP-503,ADMIN-FUND-002,Other,Fund,"Daugherty, Mitchell and Gibson",2021-11-13,126381.38,USD,Ready find along project. Deep cultural American owner friend black.,69566,APPROVED,PAID,2021-11-13,,2021-11-13,2021-11-13,1.0,2021-11-13,INTERNAL
ADMIN-EXP-504,ADMIN-FUND-002,Travel,Transaction,"Hernandez, Jones and Contreras",2022-10-26,184389.51,USD,Responsibility ball accept blue really kid six. Wait create appear enough perhaps. Tend mind page.,38001,APPROVED,UNPAID,2022-10-26,,2022-10-26,2022-10-26,1.0,2022-10-26,INTERNAL
ADMIN-EXP-505,ADMIN-FUND-002,Legal,Fund,Parker-Acosta,2021-03-19,150989.78,USD,Music country smile increase. Class attack reason student save policy. Teacher create ask.,19753,PENDING,PAID,2021-03-19,,2021-03-19,2021-03-19,1.0,2021-03-19,INTERNAL
ADMIN-EXP-506,ADMIN-FUND-002,Other,Transaction,"Morris, Cunningham and Larsen",2025-07-19,61565.13,USD,Middle dinner many drop term body. Reason drop ok film commercial door season.,93263,PENDING,PAID,2025-07-19,,2025-07-19,2025-07-19,1.0,2025-07-19,INTERNAL
ADMIN-EXP-507,ADMIN-FUND-002,Audit,Fund,Chaney-Shepherd,2023-09-11,64744.12,USD,Sign four travel executive by. Cut many area day let plant. Can season and.,99973,PENDING,UNPAID,2023-09-11,,2023-09-11,2023-09-11,1.0,2023-09-11,INTERNAL
ADMIN-EXP-508,ADMIN-FUND-002,Legal,Fund,Vargas PLC,2024-03-16,132725.81,USD,Specific former behind. Especially policy road water. Little power protect type.,79772,PAID,UNPAID,2024-03-16,,2024-03-16,2024-03-16,1.0,2024-03-16,INTERNAL
ADMIN-EXP-509,ADMIN-FUND-002,Travel,Transaction,Williams Group,2025-05-02,212844.71,USD,Year party above half. Tree career hair play cultural appear man.,34586,PAID,PAID,2025-05-02,,2025-05-02,2025-05-02,1.0,2025-05-02,INTERNAL
ADMIN-EXP-510,ADMIN-FUND-002,Audit,Fund,Williams LLC,2021-12-16,40159.17,USD,Include stuff get follow organization partner. Follow value test market smile Republican.,82432,PAID,PAID,2021-12-16,,2021-12-16,2021-12-16,1.0,2021-12-16,INTERNAL
ADMIN-EXP-511,ADMIN-FUND-002,Travel,Transaction,Phelps-Harrison,2021-12-10,196071.7,USD,High drug option seven someone. Suddenly word chair any.,66208,PAID,UNPAID,2021-12-10,,2021-12-10,2021-12-10,1.0,2021-12-10,INTERNAL
ADMIN-EXP-512,ADMIN-FUND-002,Legal,Transaction,Evans-Thomas,2021-06-08,200962.5,USD,Approach early upon heavy can way travel return.,20521,PENDING,UNPAID,2021-06-08,,2021-06-08,2021-06-08,1.0,2021-06-08,INTERNAL
ADMIN-EXP-513,ADMIN-FUND-002,Travel,Fund,Reynolds-Wheeler,2022-01-19,34151.69,USD,Yard watch take culture. Culture voice foot return.,19764,PENDING,PAID,2022-01-19,,2022-01-19,2022-01-19,1.0,2022-01-19,INTERNAL
ADMIN-EXP-514,ADMIN-FUND-002,Travel,Transaction,Evans-Jackson,2024-09-12,81964.02,USD,Four candidate raise sort.,17820,APPROVED,PAID,2024-09-12,,2024-09-12,2024-09-12,1.0,2024-09-12,INTERNAL
ADMIN-EXP-515,ADMIN-FUND-002,Other,Fund,"Johnson, Holland and Hudson",2024-10-10,136911.96,USD,School nothing few. Eat interest entire.,61008,APPROVED,PAID,2024-10-10,,2024-10-10,2024-10-10,1.0,2024-10-10,INTERNAL
ADMIN-EXP-516,ADMIN-FUND-002,Legal,Transaction,Dominguez and Sons,2022-09-18,140302.08,USD,Generation threat represent couple. Amount assume put very. Easy travel people throw half risk way.,23086,APPROVED,UNPAID,2022-09-18,,2022-09-18,2022-09-18,1.0,2022-09-18,INTERNAL
ADMIN-EXP-517,ADMIN-FUND-002,Travel,Transaction,Burton-Booth,2022-10-04,121480.8,USD,Work say least bag always attorney already.,11412,PENDING,UNPAID,2022-10-04,,2022-10-04,2022-10-04,1.0,2022-10-04,INTERNAL
ADMIN-EXP-518,ADMIN-FUND-002,Legal,Transaction,"Smith, Ramirez and Silva",2024-10-30,213026.12,USD,Keep recognize reach rule.,18779,PAID,PAID,2024-10-30,,2024-10-30,2024-10-30,1.0,2024-10-30,INTERNAL
ADMIN-EXP-519,ADMIN-FUND-002,Other,Fund,Jones LLC,2022-03-28,184763.2,USD,Along bit tax white. Place west their.,54686,APPROVED,UNPAID,2022-03-28,,2022-03-28,2022-03-28,1.0,2022-03-28,INTERNAL
ADMIN-EXP-520,ADMIN-FUND-002,Legal,Fund,Flores-Hardy,2021-05-08,63417.87,USD,Unit nature join social science. Purpose campaign she discover doctor although.,65501,PAID,PAID,2021-05-08,,2021-05-08,2021-05-08,1.0,2021-05-08,INTERNAL
ADMIN-EXP-521,ADMIN-FUND-002,Other,Transaction,Barton-Johnson,2022-09-22,187104.88,USD,Week institution book beautiful who never. Pull person score. Probably public yourself hospital.,77423,APPROVED,PAID,2022-09-22,,2022-09-22,2022-09-22,1.0,2022-09-22,INTERNAL
ADMIN-EXP-522,ADMIN-FUND-002,Other,Fund,Wong LLC,2023-03-17,30449.42,USD,Apply design indicate perform guess reality opportunity measure. Worker white through up find back.,46675,APPROVED,UNPAID,2023-03-17,,2023-03-17,2023-03-17,1.0,2023-03-17,INTERNAL
ADMIN-EXP-523,ADMIN-FUND-002,Other,Fund,"Clark, Snyder and Baker",2023-12-29,197123.14,USD,Care watch last everything street. Short itself four age. Everything stay fund.,93761,PENDING,PAID,2023-12-29,,2023-12-29,2023-12-29,1.0,2023-12-29,INTERNAL
ADMIN-EXP-524,ADMIN-FUND-002,Travel,Fund,"Long, Meadows and Arroyo",2025-07-24,63980.84,USD,Interesting fact investment sure think. Week table sign foot avoid firm else.,86040,PENDING,UNPAID,2025-07-24,,2025-07-24,2025-07-24,1.0,2025-07-24,INTERNAL
ADMIN-EXP-525,ADMIN-FUND-002,Other,Transaction,Hess Group,2023-12-11,227480.4,USD,Rate agency less major minute southern government though.,54601,APPROVED,PAID,2023-12-11,,2023-12-11,2023-12-11,1.0,2023-12-11,INTERNAL
ADMIN-EXP-526,ADMIN-FUND-002,Audit,Fund,Anderson-Garcia,2024-02-13,145901.16,USD,Sister social water college high. Model few somebody green. Once total religious onto him medical.,67512,PAID,PAID,2024-02-13,,2024-02-13,2024-02-13,1.0,2024-02-13,INTERNAL
ADMIN-EXP-527,ADMIN-FUND-002,Legal,Fund,"Tate, Mckee and Gray",2021-01-30,226736.86,USD,Wide artist forget fund sing life fill hot. More design effort report. Actually experience order.,60727,APPROVED,UNPAID,2021-01-30,,2021-01-30,2021-01-30,1.0,2021-01-30,INTERNAL
ADMIN-EXP-528,ADMIN-FUND-002,Audit,Fund,"Griffin, Byrd and Thornton",2021-01-27,125301.18,USD,Suggest guess capital office news form. Physical feel far.,69639,PAID,UNPAID,2021-01-27,,2021-01-27,2021-01-27,1.0,2021-01-27,INTERNAL
ADMIN-EXP-529,ADMIN-FUND-002,Audit,Transaction,Taylor Ltd,2021-03-24,111282.74,USD,Sell remain certain glass leader trip develop. Animal customer green pull.,25383,APPROVED,PAID,2021-03-24,,2021-03-24,2021-03-24,1.0,2021-03-24,INTERNAL
ADMIN-EXP-530,ADMIN-FUND-002,Other,Transaction,Long Group,2025-07-11,107012.37,USD,Young attack Congress education exactly. Share behavior its difference past join.,68926,PENDING,UNPAID,2025-07-11,,2025-07-11,2025-07-11,1.0,2025-07-11,INTERNAL
ADMIN-EXP-531,ADMIN-FUND-002,Audit,Transaction,"Ward, Simpson and Harris",2022-01-13,96855.53,USD,Minute personal who listen long foreign a. Fear young seven executive boy.,29642,PAID,UNPAID,2022-01-13,,2022-01-13,2022-01-13,1.0,2022-01-13,INTERNAL
ADMIN-EXP-532,ADMIN-FUND-002,Travel,Transaction,Wood-King,2024-12-17,165196.12,USD,Doctor figure plant. Series wife east large per forget human.,37536,PENDING,UNPAID,2024-12-17,,2024-12-17,2024-12-17,1.0,2024-12-17,INTERNAL
ADMIN-EXP-533,ADMIN-FUND-002,Legal,Fund,Jones PLC,2024-04-22,144565.43,USD,Near financial their computer exactly. Past yet employee thought. Feeling interesting modern.,89803,PAID,UNPAID,2024-04-22,,2024-04-22,2024-04-22,1.0,2024-04-22,INTERNAL
ADMIN-EXP-534,ADMIN-FUND-002,Legal,Transaction,Randolph-Kirk,2021-12-31,150965.84,USD,Reveal culture factor recognize wonder town notice. Huge indeed simple build.,95769,APPROVED,PAID,2021-12-31,,2021-12-31,2021-12-31,1.0,2021-12-31,INTERNAL
ADMIN-EXP-535,ADMIN-FUND-002,Other,Transaction,Hudson-Soto,2023-11-25,93195.17,USD,Election if window up. Key would lay hotel kitchen point.,28425,PAID,UNPAID,2023-11-25,,2023-11-25,2023-11-25,1.0,2023-11-25,INTERNAL
ADMIN-EXP-536,ADMIN-FUND-002,Travel,Transaction,Forbes Group,2025-04-21,77059.45,USD,Generation fire yeah tax. Newspaper step four know.,16364,APPROVED,UNPAID,2025-04-21,,2025-04-21,2025-04-21,1.0,2025-04-21,INTERNAL
ADMIN-EXP-537,ADMIN-FUND-002,Audit,Transaction,"Levy, Ochoa and Davis",2020-12-24,134783.93,USD,Front feel idea foreign. Attorney often protect group number system large amount.,82834,PENDING,UNPAID,2020-12-24,,2020-12-24,2020-12-24,1.0,2020-12-24,INTERNAL
ADMIN-EXP-538,ADMIN-FUND-002,Other,Transaction,Floyd Group,2022-10-31,77653.21,USD,Star six ever test oil chair.,25263,PAID,PAID,2022-10-31,,2022-10-31,2022-10-31,1.0,2022-10-31,INTERNAL
ADMIN-EXP-539,ADMIN-FUND-002,Travel,Transaction,"Lee, Sherman and Stanton",2024-05-17,98584.07,USD,Hard able project sister.,50765,APPROVED,PAID,2024-05-17,,2024-05-17,2024-05-17,1.0,2024-05-17,INTERNAL
ADMIN-EXP-540,ADMIN-FUND-002,Travel,Transaction,Clark-Allen,2023-12-30,110610.85,USD,Management cultural bill think build worry.,49673,APPROVED,UNPAID,2023-12-30,,2023-12-30,2023-12-30,1.0,2023-12-30,INTERNAL
ADMIN-EXP-541,ADMIN-FUND-002,Legal,Transaction,"Williams, Lin and Young",2023-12-11,139997.59,USD,Majority indicate west notice. Training step within.,65610,PAID,UNPAID,2023-12-11,,2023-12-11,2023-12-11,1.0,2023-12-11,INTERNAL
