expense_id,fund_code,expense_type,expense_category,vendor_name,expense_date,expense_amount,expense_currency,description,invoice_number,approval_status,payment_status,payment_date,allocated_to_investments,created_date,last_modified_date,fx_rate,fx_rate_as_of,fx_rate_source
ADMIN-EXP-1398,ADMIN-FUND-004,Other,Transaction,Walton-Green,2020-12-26,35821.33,USD,And begin pretty despite month cause. Assume figure old modern stay agent able.,49074,PENDING,PAID,2020-12-26,,2020-12-26,2020-12-26,1.0,2020-12-26,INTERNAL
ADMIN-EXP-1399,ADMIN-FUND-004,Legal,Transaction,Montoya and Sons,2022-07-23,13766.01,USD,Near bag second include appear my. Cup manager five. Subject her charge quickly without hold.,89318,PENDING,UNPAID,2022-07-23,,2022-07-23,2022-07-23,1.0,2022-07-23,INTERNAL
ADMIN-EXP-1400,ADMIN-FUND-004,Other,Fund,Clements-Smith,2025-02-02,40921.48,USD,Student growth box able hair. South who song red long else. Value gun left radio most if Democrat.,44317,PENDING,PAID,2025-02-02,,2025-02-02,2025-02-02,1.0,2025-02-02,INTERNAL
ADMIN-EXP-1401,ADMIN-FUND-004,Legal,Fund,Green-Miller,2024-12-07,38494.4,USD,Tough close plan our low. Yet former military himself big today.,81437,PAID,UNPAID,2024-12-07,,2024-12-07,2024-12-07,1.0,2024-12-07,INTERNAL
ADMIN-EXP-1402,ADMIN-FUND-004,Audit,Transaction,Perry-Moore,2025-05-21,41659.12,USD,Marriage hand center end look else.,27748,PAID,PAID,2025-05-21,,2025-05-21,2025-05-21,1.0,2025-05-21,INTERNAL
ADMIN-EXP-1403,ADMIN-FUND-004,Audit,Fund,Park-Carter,2022-11-11,56216.12,USD,Charge themselves contain ten. Moment who personal work every heavy expert.,94691,PENDING,PAID,2022-11-11,,2022-11-11,2022-11-11,1.0,2022-11-11,INTERNAL
ADMIN-EXP-1404,ADMIN-FUND-004,Audit,Transaction,"Melton, Garrett and Fields",2021-10-05,59716.36,USD,Care reveal economic rule now drug simply. Senior near low line material seven contain.,71986,PENDING,UNPAID,2021-10-05,,2021-10-05,2021-10-05,1.0,2021-10-05,INTERNAL
ADMIN-EXP-1405,ADMIN-FUND-004,Travel,Fund,"Hernandez, Lee and Valencia",2023-12-05,24198.11,USD,Born husband tough ability. Bring foreign government color anyone physical feel.,58313,PENDING,PAID,2023-12-05,,2023-12-05,2023-12-05,1.0,2023-12-05,INTERNAL
ADMIN-EXP-1406,ADMIN-FUND-004,Audit,Transaction,Kirk Inc,2021-12-09,54069.2,USD,Discuss stay mouth finally adult moment.,67301,APPROVED,PAID,2021-12-09,,2021-12-09,2021-12-09,1.0,2021-12-09,INTERNAL
ADMIN-EXP-1407,ADMIN-FUND-004,Travel,Fund,Estrada Inc,2021-06-01,45986.34,USD,Number position different fund. Magazine resource sort others tough.,33243,PAID,PAID,2021-06-01,,2021-06-01,2021-06-01,1.0,2021-06-01,INTERNAL
ADMIN-EXP-1408,ADMIN-FUND-004,Audit,Transaction,"Snyder, Hammond and Johnson",2023-05-01,74461.6,USD,Best table service ready. Rich friend shake my break. Blue myself your impact stuff wonder pay.,36035,PENDING,PAID,2023-05-01,,2023-05-01,2023-05-01,1.0,2023-05-01,INTERNAL
ADMIN-EXP-1409,ADMIN-FUND-004,Other,Fund,"Zuniga, Freeman and Barron",2024-12-08,42990.38,USD,Oil blue whether already both talk. Forget letter black wall. Air parent boy affect guy.,90757,APPROVED,UNPAID,2024-12-08,,2024-12-08,2024-12-08,1.0,2024-12-08,INTERNAL
ADMIN-EXP-1410,ADMIN-FUND-004,Travel,Fund,"Schultz, Estrada and Smith",2025-10-22,41852.03,USD,His cold five wide morning others. Thank nor bill certainly. Professional can rest join.,37097,PAID,UNPAID,2025-10-22,,2025-10-22,2025-10-22,1.0,2025-10-22,INTERNAL
ADMIN-EXP-1411,ADMIN-FUND-004,Audit,Transaction,Richardson Group,2024-06-09,12875.73,USD,Five evening because method grow.,31573,APPROVED,UNPAID,2024-06-09,,2024-06-09,2024-06-09,1.0,2024-06-09,INTERNAL
ADMIN-EXP-1412,ADMIN-FUND-004,Audit,Fund,Carter LLC,2025-10-06,26357.04,USD,Newspaper draw wide technology left meet treatment. Yeah describe sometimes price improve record.,27113,PENDING,PAID,2025-10-06,,2025-10-06,2025-10-06,1.0,2025-10-06,INTERNAL
ADMIN-EXP-1413,ADMIN-FUND-004,Other,Transaction,Anderson Inc,2022-04-24,20446.84,USD,Per best example onto. Begin begin just age.,19966,PENDING,UNPAID,2022-04-24,,2022-04-24,2022-04-24,1.0,2022-04-24,INTERNAL
ADMIN-EXP-1414,ADMIN-FUND-004,Other,Transaction,Contreras Inc,2022-07-08,25273.33,USD,Its design left argue. Couple especially four movie box bring during.,63698,PENDING,PAID,2022-07-08,,2022-07-08,2022-07-08,1.0,2022-07-08,INTERNAL
ADMIN-EXP-1415,ADMIN-FUND-004,Audit,Fund,Brown Group,2022-08-09,49957.03,USD,Seek travel maintain. Image school foreign street.,22207,PENDING,UNPAID,2022-08-09,,2022-08-09,2022-08-09,1.0,2022-08-09,INTERNAL
ADMIN-EXP-1416,ADMIN-FUND-004,Travel,Transaction,"Livingston, Phillips and Cook",2023-02-04,38579.62,USD,Hand child environmental both.,36867,PAID,UNPAID,2023-02-04,,2023-02-04,2023-02-04,1.0,2023-02-04,INTERNAL
ADMIN-EXP-1417,ADMIN-FUND-004,Audit,Transaction,Harrington-Wu,2022-03-11,63273.07,USD,Dream within before beat cost. Decide cause week itself type lay north.,76317,PAID,UNPAID,2022-03-11,,2022-03-11,2022-03-11,1.0,2022-03-11,INTERNAL
ADMIN-EXP-1418,ADMIN-FUND-004,Audit,Transaction,"Robinson, Reed and Rodriguez",2022-02-21,17288.38,USD,Store across week point southern concern model ground. Learn it song program these lose.,24841,PAID,UNPAID,2022-02-21,,2022-02-21,2022-02-21,1.0,2022-02-21,INTERNAL
ADMIN-EXP-1419,ADMIN-FUND-004,Audit,Transaction,Morris-Castillo,2024-05-04,13825.15,USD,Partner tend late. Top month expect including option.,67034,APPROVED,UNPAID,2024-05-04,,2024-05-04,2024-05-04,1.0,2024-05-04,INTERNAL
ADMIN-EXP-1420,ADMIN-FUND-004,Travel,Fund,"Green, Colon and Dean",2022-12-27,49151.22,USD,Southern cell only hold career fear. Sport write vote especially person force join not.,10012,PAID,UNPAID,2022-12-27,,2022-12-27,2022-12-27,1.0,2022-12-27,INTERNAL
ADMIN-EXP-1421,ADMIN-FUND-004,Other,Transaction,Allen-Rodriguez,2022-09-02,51716.74,USD,Behavior sort direction bed arm.,76092,PAID,PAID,2022-09-02,,2022-09-02,2022-09-02,1.0,2022-09-02,INTERNAL
ADMIN-EXP-1422,ADMIN-FUND-004,Other,Fund,Miller-Martin,2021-06-13,40528.44,USD,There each lawyer newspaper. Expect produce along weight score.,65695,APPROVED,PAID,2021-06-13,,2021-06-13,2021-06-13,1.0,2021-06-13,INTERNAL
ADMIN-EXP-1423,ADMIN-FUND-004,Other,Transaction,"Kent, Hester and Knox",2022-07-07,24156.64,USD,Bank state activity. Partner voice meeting quality add including people.,94046,PAID,PAID,2022-07-07,,2022-07-07,2022-07-07,1.0,2022-07-07,INTERNAL
ADMIN-EXP-1424,ADMIN-FUND-004,Other,Transaction,Anderson Inc,2020-12-12,36984.81,USD,Second blood laugh hundred. Seem standard system level outside. Impact free research always.,84608,PENDING,UNPAID,2020-12-12,,2020-12-12,2020-12-12,1.0,2020-12-12,INTERNAL
ADMIN-EXP-1425,ADMIN-FUND-004,Audit,Transaction,"Figueroa, Rush and Ramos",2022-12-28,74595.95,USD,Attention table exist front within second. Interesting special owner risk much.,17241,PAID,UNPAID,2022-12-28,,2022-12-28,2022-12-28,1.0,2022-12-28,INTERNAL
ADMIN-EXP-1426,ADMIN-FUND-004,Audit,Fund,"Lang, Wall and Mcclure",2024-04-03,39103.17,USD,System him court best. Describe small data people maybe either these.,28415,PAID,UNPAID,2024-04-03,,2024-04-03,2024-04-03,1.0,2024-04-03,INTERNAL
ADMIN-EXP-1427,ADMIN-FUND-004,Travel,Transaction,"Butler, Powell and Hill",2023-08-21,61616.31,USD,Exist author college you follow far value. Who walk book.,34007,PENDING,UNPAID,2023-08-21,,2023-08-21,2023-08-21,1.0,2023-08-21,INTERNAL
ADMIN-EXP-1428,ADMIN-FUND-004,Other,Fund,Lynch-Nunez,2024-07-21,16966.42,USD,Open modern society author billion. Environment last resource so.,85170,APPROVED,UNPAID,2024-07-21,,2024-07-21,2024-07-21,1.0,2024-07-21,INTERNAL
ADMIN-EXP-1429,ADMIN-FUND-004,Travel,Transaction,Woods-Dodson,2025-05-04,16418.81,USD,Program then deal amount. Close authority education plant pretty interesting art.,41632,APPROVED,UNPAID,2025-05-04,,2025-05-04,2025-05-04,1.0,2025-05-04,INTERNAL
ADMIN-EXP-1430,ADMIN-FUND-004,Travel,Fund,"Osborne, Frye and Larsen",2021-12-13,64782.28,USD,Alone style among adult marriage. Brother agency protect clearly lose.,79360,PENDING,PAID,2021-12-13,,2021-12-13,2021-12-13,1.0,2021-12-13,INTERNAL
ADMIN-EXP-1431,ADMIN-FUND-004,Other,Transaction,"Cruz, Garner and Gregory",2025-08-16,55088.36,USD,Rule plant method figure either beyond. Sometimes its car far cup prove.,75779,APPROVED,UNPAID,2025-08-16,,2025-08-16,2025-08-16,1.0,2025-08-16,INTERNAL
ADMIN-EXP-1432,ADMIN-FUND-004,Legal,Transaction,Sanders-Wood,2021-06-12,39060.17,USD,Me easy knowledge serve rise final. Reality remember husband program.,36076,PAID,UNPAID,2021-06-12,,2021-06-12,2021-06-12,1.0,2021-06-12,INTERNAL
ADMIN-EXP-1433,ADMIN-FUND-004,Audit,Transaction,"Wise, Allen and Cook",2023-06-05,12585.67,USD,More another popular partner provide I behavior. Nothing morning avoid mention.,62309,PENDING,UNPAID,2023-06-05,,2023-06-05,2023-06-05,1.0,2023-06-05,INTERNAL
ADMIN-EXP-1434,ADMIN-FUND-004,Audit,Transaction,Lucas-Hernandez,2023-09-24,39450.63,USD,Rate participant fly tend else. Occur hotel organization ground. Onto mention kind second.,41917,PAID,UNPAID,2023-09-24,,2023-09-24,2023-09-24,1.0,2023-09-24,INTERNAL
ADMIN-EXP-1435,ADMIN-FUND-004,Legal,Fund,Zavala PLC,2024-03-07,30753.9,USD,World say style box kid police necessary.,93729,PAID,UNPAID,2024-03-07,,2024-03-07,2024-03-07,1.0,2024-03-07,INTERNAL
ADMIN-EXP-1436,ADMIN-FUND-004,Travel,Transaction,"Campbell, Hansen and Thomas",2023-02-11,74671.85,USD,Long enter impact technology sell per. Your huge hear home standard.,48491,APPROVED,PAID,2023-02-11,,2023-02-11,2023-02-11,1.0,2023-02-11,INTERNAL
ADMIN-EXP-1437,ADMIN-FUND-004,Legal,Fund,Aguilar-Mitchell,2021-09-01,62091.18,USD,Production season then player fill. Body offer newspaper.,61608,APPROVED,PAID,2021-09-01,,2021-09-01,2021-09-01,1.0,2021-09-01,INTERNAL
ADMIN-EXP-1438,ADMIN-FUND-004,Audit,Transaction,"Jenkins, Kemp and Carroll",2023-07-20,18864.12,USD,Reveal radio still mention. Those its give market. Oil that bit thus music important it.,31593,PENDING,UNPAID,2023-07-20,,2023-07-20,2023-07-20,1.0,2023-07-20,INTERNAL
ADMIN-EXP-1439,ADMIN-FUND-004,Legal,Transaction,"Singh, Kirk and Francis",2023-12-27,12082.58,USD,Myself wear gas machine put only station. Magazine leader language adult.,38957,APPROVED,UNPAID,2023-12-27,,2023-12-27,2023-12-27,1.0,2023-12-27,INTERNAL
ADMIN-EXP-1440,ADMIN-FUND-004,Audit,Fund,Larsen-Jones,2025-06-13,26899.46,USD,Agreement miss visit difference throughout.,94790,PAID,UNPAID,2025-06-13,,2025-06-13,2025-06-13,1.0,2025-06-13,INTERNAL
ADMIN-EXP-1441,ADMIN-FUND-004,Travel,Fund,Parker LLC,2023-07-24,60884.75,USD,Do between poor minute. Product term even necessary today commercial month.,14569,PENDING,UNPAID,2023-07-24,,2023-07-24,2023-07-24,1.0,2023-07-24,INTERNAL
ADMIN-EXP-1442,ADMIN-FUND-004,Legal,Transaction,Martin-Murphy,2024-08-16,56288.86,USD,Ability skin style able official bit. Mean maintain imagine degree Congress space dark.,82107,PAID,UNPAID,2024-08-16,,2024-08-16,2024-08-16,1.0,2024-08-16,INTERNAL
ADMIN-EXP-1443,ADMIN-FUND-004,Travel,Transaction,Munoz Ltd,2023-01-12,16489.8,USD,We prepare store assume. Debate myself commercial happy. Be movie type with network treat.,11342,PAID,UNPAID,2023-01-12,,2023-01-12,2023-01-12,1.0,2023-01-12,INTERNAL
ADMIN-EXP-1444,ADMIN-FUND-004,Other,Fund,"Chavez, Brown and Powell",2025-03-13,47165.74,USD,Less character dream month. Old little individual performance. Wind when during modern.,75793,PENDING,PAID,2025-03-13,,2025-03-13,2025-03-13,1.0,2025-03-13,INTERNAL
ADMIN-EXP-1445,ADMIN-FUND-004,Other,Fund,"Brown, Hayden and Burns",2025-05-26,73017.7,USD,View material better there believe report. Rich happen benefit one.,75678,APPROVED,UNPAID,2025-05-26,,2025-05-26,2025-05-26,1.0,2025-05-26,INTERNAL
ADMIN-EXP-1446,ADMIN-FUND-004,Legal,Fund,"Romero, Warren and Lee",2023-07-14,69078.33,USD,Church pretty middle attack career. Physical citizen time describe star.,40123,PAID,UNPAID,2023-07-14,,2023-07-14,2023-07-14,1.0,2023-07-14,INTERNAL
ADMIN-EXP-1447,ADMIN-FUND-004,Legal,Fund,Michael Ltd,2025-04-30,71658.93,USD,People wait situation first watch help.,70674,PAID,PAID,2025-04-30,,2025-04-30,2025-04-30,1.0,2025-04-30,INTERNAL
ADMIN-EXP-1448,ADMIN-FUND-004,Other,Transaction,Brown Inc,2024-05-21,18526.27,USD,Next night impact own section help important. Chance bring bit clearly husband kind health develop.,89028,APPROVED,PAID,2024-05-21,,2024-05-21,2024-05-21,1.0,2024-05-21,INTERNAL
ADMIN-EXP-1449,ADMIN-FUND-004,Travel,Transaction,"Scott, Gibson and Buchanan",2023-04-28,71584.31,USD,Skill operation score some. Choose although moment. Mouth take work along.,31598,PENDING,PAID,2023-04-28,,2023-04-28,2023-04-28,1.0,2023-04-28,INTERNAL
ADMIN-EXP-1450,ADMIN-FUND-004,Other,Transaction,Colon PLC,2021-03-26,9685.85,USD,Sea kitchen book close almost range trip. Provide land war forget whose appear establish probably.,73680,PENDING,PAID,2021-03-26,,2021-03-26,2021-03-26,1.0,2021-03-26,INTERNAL
ADMIN-EXP-1451,ADMIN-FUND-004,Other,Transaction,"Lee, Castro and Thomas",2024-01-26,65847.68,USD,Low provide throw fish. Forget consumer TV school.,45423,APPROVED,PAID,2024-01-26,,2024-01-26,2024-01-26,1.0,2024-01-26,INTERNAL
ADMIN-EXP-1452,ADMIN-FUND-004,Legal,Fund,"Rogers, Hayes and Tucker",2023-05-16,33010.73,USD,Health property room large boy defense us something.,47016,APPROVED,UNPAID,2023-05-16,,2023-05-16,2023-05-16,1.0,2023-05-16,INTERNAL
ADMIN-EXP-1453,ADMIN-FUND-004,Audit,Transaction,Hogan Ltd,2023-10-31,15278.03,USD,Want majority follow human. Sport end major base up decide everybody son.,35881,APPROVED,UNPAID,2023-10-31,,2023-10-31,2023-10-31,1.0,2023-10-31,INTERNAL
ADMIN-EXP-1454,ADMIN-FUND-004,Travel,Fund,"Perez, Zimmerman and Morris",2021-10-10,23378.59,USD,Realize contain action read during. Customer its seem when him most you.,43532,APPROVED,UNPAID,2021-10-10,,2021-10-10,2021-10-10,1.0,2021-10-10,INTERNAL
ADMIN-EXP-1455,ADMIN-FUND-004,Legal,Fund,Williams-Ibarra,2023-11-18,47899.78,USD,Consider head after baby night food. Hundred local big age throw minute.,56081,PENDING,PAID,2023-11-18,,2023-11-18,2023-11-18,1.0,2023-11-18,INTERNAL
ADMIN-EXP-1456,ADMIN-FUND-004,Other,Transaction,Vaughn LLC,2024-07-10,69361.44,USD,Country break friend plan turn be. Consider get surface bill.,94694,PAID,PAID,2024-07-10,,2024-07-10,2024-07-10,1.0,2024-07-10,INTERNAL
ADMIN-EXP-1457,ADMIN-FUND-004,Travel,Fund,"Harris, Schneider and Thornton",2021-07-13,22283.12,USD,Who another side gun him. Guess try positive far local.,62013,APPROVED,PAID,2021-07-13,,2021-07-13,2021-07-13,1.0,2021-07-13,INTERNAL
ADMIN-EXP-1458,ADMIN-FUND-004,Legal,Transaction,Owens-Morris,2020-11-28,39536.11,USD,Even hit later six line. Lead program contain religious culture.,11941,PENDING,PAID,2020-11-28,,2020-11-28,2020-11-28,1.0,2020-11-28,INTERNAL
ADMIN-EXP-1459,ADMIN-FUND-004,Legal,Fund,Guerra-Tucker,2024-02-12,46495.69,USD,Item difference free like. Thing budget education agree either. International economic class.,79993,APPROVED,PAID,2024-02-12,,2024-02-12,2024-02-12,1.0,2024-02-12,INTERNAL
ADMIN-EXP-1460,ADMIN-FUND-004,Legal,Transaction,Smith PLC,2024-09-10,62556.4,USD,Major significant it opportunity you.,97129,PAID,PAID,2024-09-10,,2024-09-10,2024-09-10,1.0,2024-09-10,INTERNAL
ADMIN-EXP-1461,ADMIN-FUND-004,Legal,Fund,Cruz-Vasquez,2022-12-10,36058.02,USD,Nearly century central management outside artist none. When past responsibility time.,46640,PAID,PAID,2022-12-10,,2022-12-10,2022-12-10,1.0,2022-12-10,INTERNAL
ADMIN-EXP-1462,ADMIN-FUND-004,Travel,Transaction,Clark LLC,2024-12-05,18535.27,USD,Police picture star next talk that. Memory soldier stay audience call evening.,17644,APPROVED,PAID,2024-12-05,,2024-12-05,2024-12-05,1.0,2024-12-05,INTERNAL
ADMIN-EXP-1463,ADMIN-FUND-004,Audit,Fund,Greene-Serrano,2023-01-02,14321.32,USD,Lay assume agree. Week only discover pick she feeling.,56348,PENDING,PAID,2023-01-02,,2023-01-02,2023-01-02,1.0,2023-01-02,INTERNAL
ADMIN-EXP-1464,ADMIN-FUND-004,Other,Fund,"Olson, Harper and Fowler",2022-08-27,33489.11,USD,South study wait. Media human just range information me.,42252,PENDING,PAID,2022-08-27,,2022-08-27,2022-08-27,1.0,2022-08-27,INTERNAL
ADMIN-EXP-1465,ADMIN-FUND-004,Audit,Fund,Harris-Burnett,2020-12-27,10956.39,USD,All hair possible American garden. Lay week future bag.,59490,PENDING,PAID,2020-12-27,,2020-12-27,2020-12-27,1.0,2020-12-27,INTERNAL
ADMIN-EXP-1466,ADMIN-FUND-004,Travel,Fund,"Park, Hensley and Cross",2025-09-17,49708.6,USD,Everyone professional before southern feeling. Almost stage can threat sport notice decide.,30323,APPROVED,PAID,2025-09-17,,2025-09-17,2025-09-17,1.0,2025-09-17,INTERNAL
ADMIN-EXP-1467,ADMIN-FUND-004,Other,Fund,Garcia-Hernandez,2023-11-25,36044.08,USD,Say six agent create can. Just marriage bank discuss.,15185,PENDING,PAID,2023-11-25,,2023-11-25,2023-11-25,1.0,2023-11-25,INTERNAL
ADMIN-EXP-1468,ADMIN-FUND-004,Travel,Transaction,Long-Miller,2022-04-07,42352.99,USD,Anything long employee only authority. Support store cup agreement. Great person ten court.,77327,PENDING,UNPAID,2022-04-07,,2022-04-07,2022-04-07,1.0,2022-04-07,INTERNAL
ADMIN-EXP-1469,ADMIN-FUND-004,Travel,Fund,Miller-Small,2022-04-25,24926.24,USD,Guess exist point per of record. Skill according society.,70535,APPROVED,PAID,2022-04-25,,2022-04-25,2022-04-25,1.0,2022-04-25,INTERNAL
ADMIN-EXP-1470,ADMIN-FUND-004,Travel,Fund,Clark LLC,2023-12-17,49260.76,USD,During note poor able language. Certain focus coach father really. Report car sure bank push.,37159,APPROVED,PAID,2023-12-17,,2023-12-17,2023-12-17,1.0,2023-12-17,INTERNAL
ADMIN-EXP-1471,ADMIN-FUND-004,Other,Fund,Miller Ltd,2022-08-03,73795.2,USD,Address both picture measure camera money. Mean letter language across none PM.,52988,PENDING,PAID,2022-08-03,,2022-08-03,2022-08-03,1.0,2022-08-03,INTERNAL
ADMIN-EXP-1472,ADMIN-FUND-004,Audit,Fund,Ortiz-Miller,2025-03-08,46234.98,USD,Coach environmental movie easy. Democrat fact free pull. Nation it partner plant.,48763,PENDING,UNPAID,2025-03-08,,2025-03-08,2025-03-08,1.0,2025-03-08,INTERNAL
ADMIN-EXP-1473,ADMIN-FUND-004,Travel,Fund,Fry-Craig,2024-03-05,43247.81,USD,Too beat at accept could take fall. White sort somebody our.,62667,PENDING,UNPAID,2024-03-05,,2024-03-05,2024-03-05,1.0,2024-03-05,INTERNAL
ADMIN-EXP-1474,ADMIN-FUND-004,Audit,Transaction,Hill Group,2022-06-12,45929.02,USD,Personal prevent home everybody recognize degree.,17527,PENDING,PAID,2022-06-12,,2022-06-12,2022-06-12,1.0,2022-06-12,INTERNAL
ADMIN-EXP-1475,ADMIN-FUND-004,Audit,Transaction,Barron Ltd,2021-09-06,23969.48,USD,Cell street quickly realize. Rule economy nearly evening fast.,63882,PAID,PAID,2021-09-06,,2021-09-06,2021-09-06,1.0,2021-09-06,INTERNAL
ADMIN-EXP-1476,ADMIN-FUND-004,Audit,Transaction,Lewis-Porter,2023-02-17,74728.46,USD,Too yeah budget. Anyone discuss many or born. Go south of sort act.,95140,PENDING,PAID,2023-02-17,,2023-02-17,2023-02-17,1.0,2023-02-17,INTERNAL
ADMIN-EXP-1477,ADMIN-FUND-004,Audit,Fund,"Andrews, Miller and Harris",2024-03-29,45501.31,USD,Yet writer health me first turn. State kitchen fight some wait business place.,57299,APPROVED,PAID,2024-03-29,,2024-03-29,2024-03-29,1.0,2024-03-29,INTERNAL
ADMIN-EXP-1478,ADMIN-FUND-004,Other,Transaction,Hansen-Kramer,2020-11-28,74144.23,USD,Central science especially. Program occur still pull evening.,90880,PAID,PAID,2020-11-28,,2020-11-28,2020-11-28,1.0,2020-11-28,INTERNAL
ADMIN-EXP-1479,ADMIN-FUND-004,Travel,Fund,Colon Ltd,2021-09-16,39110.52,USD,Somebody season vote watch.,28980,APPROVED,PAID,2021-09-16,,2021-09-16,2021-09-16,1.0,2021-09-16,INTERNAL
ADMIN-EXP-1480,ADMIN-FUND-004,Audit,Fund,"Reed, Brown and Hill",2023-10-07,40979.98,USD,Home moment resource site. Another approach candidate production.,66649,APPROVED,UNPAID,2023-10-07,,2023-10-07,2023-10-07,1.0,2023-10-07,INTERNAL
ADMIN-EXP-1481,ADMIN-FUND-004,Audit,Fund,Long-Conrad,2024-10-16,25511.02,USD,Recent whom candidate material newspaper trade thus. Even practice letter example.,13687,APPROVED,PAID,2024-10-16,,2024-10-16,2024-10-16,1.0,2024-10-16,INTERNAL
ADMIN-EXP-1482,ADMIN-FUND-004,Other,Transaction,Baird-Richards,2021-04-16,75806.98,USD,Ahead space participant lead time box quality. Lay listen skin community politics finally each.,17120,PENDING,UNPAID,2021-04-16,,2021-04-16,2021-04-16,1.0,2021-04-16,INTERNAL
ADMIN-EXP-1483,ADMIN-FUND-004,Other,Fund,"Gibson, Rowe and Jackson",2023-12-25,20759.25,USD,Type staff could account. Training ability point way clear.,86168,APPROVED,PAID,2023-12-25,,2023-12-25,2023-12-25,1.0,2023-12-25,INTERNAL
ADMIN-EXP-1484,ADMIN-FUND-004,Other,Transaction,Saunders PLC,2023-10-04,39110.12,USD,Far bar art none. Establish because head cell call class.,20636,PAID,UNPAID,2023-10-04,,2023-10-04,2023-10-04,1.0,2023-10-04,INTERNAL
ADMIN-EXP-1485,ADMIN-FUND-004,Legal,Transaction,Wise Inc,2022-07-24,40911.72,USD,Movie major night. Check doctor forward father. In media less here finish window real.,75323,PENDING,PAID,2022-07-24,,2022-07-24,2022-07-24,1.0,2022-07-24,INTERNAL
ADMIN-EXP-1486,ADMIN-FUND-004,Travel,Transaction,Bush and Sons,2024-12-18,67106.69,USD,Though down music. Later race role case role meeting.,91794,PAID,UNPAID,2024-12-18,,2024-12-18,2024-12-18,1.0,2024-12-18,INTERNAL
ADMIN-EXP-1487,ADMIN-FUND-004,Audit,Fund,Young-Williams,2021-12-02,35774.82,USD,According why house field picture between unit operation. Forget take Mrs model exactly help note.,25993,PENDING,UNPAID,2021-12-02,,2021-12-02,2021-12-02,1.0,2021-12-02,INTERNAL
ADMIN-EXP-1488,ADMIN-FUND-005,Other,Transaction,"Thompson, Walsh and Yoder",2022-07-09,58553.37,EUR,Value human ready agree central. Energy maybe arrive sell wait central say million.,65298,PENDING,PAID,2022-07-09,,2022-07-09,2022-07-09,1.0,2022-07-09,INTERNAL
ADMIN-EXP-1489,ADMIN-FUND-005,Legal,Fund,Snow PLC,2025-08-22,43123.25,EUR,Bring knowledge no nor movement strong officer.,95191,PAID,UNPAID,2025-08-22,,2025-08-22,2025-08-22,1.0,2025-08-22,INTERNAL
ADMIN-EXP-1490,ADMIN-FUND-005,Travel,Transaction,"Dean, Scott and Jackson",2024-03-07,46168.29,EUR,Population piece under. Number thank speak detail.,67368,PAID,PAID,2024-03-07,,2024-03-07,2024-03-07,1.0,2024-03-07,INTERNAL
ADMIN-EXP-1491,ADMIN-FUND-005,Audit,Fund,Brown Ltd,2021-01-13,14177.57,EUR,Less song for. Course eight whose partner on safe. Produce trouble order natural PM us.,46721,APPROVED,UNPAID,2021-01-13,,2021-01-13,2021-01-13,1.0,2021-01-13,INTERNAL
ADMIN-EXP-1492,ADMIN-FUND-005,Travel,Transaction,Morris-Foster,2021-07-15,58840.06,EUR,Form forget even decade matter.,19137,APPROVED,UNPAID,2021-07-15,,2021-07-15,2021-07-15,1.0,2021-07-15,INTERNAL
ADMIN-EXP-1493,ADMIN-FUND-005,Audit,Transaction,Williams PLC,2023-02-28,42759.22,EUR,Character account start. Continue future song everyone hot wrong. Small full itself could learn.,67212,APPROVED,UNPAID,2023-02-28,,2023-02-28,2023-02-28,1.0,2023-02-28,INTERNAL
ADMIN-EXP-1494,ADMIN-FUND-005,Travel,Fund,"Smith, Ford and Mendoza",2021-08-04,19823.02,EUR,Federal do activity not. Plan close behind sound community.,18185,PAID,UNPAID,2021-08-04,,2021-08-04,2021-08-04,1.0,2021-08-04,INTERNAL
ADMIN-EXP-1495,ADMIN-FUND-005,Travel,Fund,"Smith, Palmer and Maddox",2024-03-01,50104.09,EUR,Since push night soon finally save while. Case group nature right above recently.,65407,PAID,UNPAID,2024-03-01,,2024-03-01,2024-03-01,1.0,2024-03-01,INTERNAL
ADMIN-EXP-1496,ADMIN-FUND-005,Legal,Fund,Marshall LLC,2023-07-27,35273.42,EUR,Visit leave plan record remain history sell care.,88328,PENDING,PAID,2023-07-27,,2023-07-27,2023-07-27,1.0,2023-07-27,INTERNAL
ADMIN-EXP-1497,ADMIN-FUND-005,Audit,Fund,Brown-Cruz,2022-04-17,20315.9,EUR,Within test list quite design decide list.,65387,PENDING,UNPAID,2022-04-17,,2022-04-17,2022-04-17,1.0,2022-04-17,INTERNAL
ADMIN-EXP-1498,ADMIN-FUND-005,Legal,Transaction,Grant PLC,2024-12-27,22905.68,EUR,Notice line hand goal get adult. Wear understand sign natural main.,43701,PENDING,PAID,2024-12-27,,2024-12-27,2024-12-27,1.0,2024-12-27,INTERNAL
ADMIN-EXP-1499,ADMIN-FUND-005,Travel,Fund,Hurley-Gardner,2021-07-17,58102.35,EUR,Situation media reality. Family ability election treat your enter spend.,45433,PAID,UNPAID,2021-07-17,,2021-07-17,2021-07-17,1.0,2021-07-17,INTERNAL
ADMIN-EXP-1500,ADMIN-FUND-005,Audit,Transaction,"Blair, Pearson and Sanchez",2022-11-27,37326.19,EUR,Impact chance involve letter approach. Run time pretty particularly sell.,68679,PENDING,PAID,2022-11-27,,2022-11-27,2022-11-27,1.0,2022-11-27,INTERNAL
ADMIN-EXP-1501,ADMIN-FUND-005,Audit,Fund,Oliver Group,2021-09-04,37734.21,EUR,Only thought eye nothing either appear. Ahead language state walk them.,52932,PAID,UNPAID,2021-09-04,,2021-09-04,2021-09-04,1.0,2021-09-04,INTERNAL
ADMIN-EXP-1502,ADMIN-FUND-005,Audit,Transaction,Spence PLC,2025-08-18,56776.42,EUR,Learn write their person. Next poor serious mind meeting share ever image.,30075,PAID,PAID,2025-08-18,,2025-08-18,2025-08-18,1.0,2025-08-18,INTERNAL
ADMIN-EXP-1503,ADMIN-FUND-005,Audit,Transaction,Fritz and Sons,2022-11-02,46548.19,EUR,Method information least morning they.,61192,PENDING,PAID,2022-11-02,,2022-11-02,2022-11-02,1.0,2022-11-02,INTERNAL
ADMIN-EXP-1504,ADMIN-FUND-005,Travel,Fund,Erickson-Bowers,2023-08-03,22980.12,EUR,Together debate risk risk million expect. Both nature conference already receive example actually.,65839,PAID,PAID,2023-08-03,,2023-08-03,2023-08-03,1.0,2023-08-03,INTERNAL
ADMIN-EXP-1505,ADMIN-FUND-005,Audit,Transaction,Sellers-Ortiz,2025-04-21,9498.18,EUR,Value idea page impact natural today. Fast hear under of responsibility.,93395,PENDING,PAID,2025-04-21,,2025-04-21,2025-04-21,1.0,2025-04-21,INTERNAL
ADMIN-EXP-1506,ADMIN-FUND-005,Audit,Fund,"Powell, Garcia and Brown",2020-12-28,42983.78,EUR,Floor act become computer. Century artist us fine other difference.,53254,APPROVED,PAID,2020-12-28,,2020-12-28,2020-12-28,1.0,2020-12-28,INTERNAL
